pmid,article_name,author,magazine_name,publish_time,
33132204,Novel compound heterozygous variants in the STIL gene identified in a Chinese family with presentation of foetal microcephaly.,"Cheng C, Yang Y, Zhu X, Yu X, Zhang T, Yang F, Chen F, Chen X, Zhao S, Guo J",European journal of medical genetics,2020/11/3,
32833257,Raine syndrome: Prenatal diagnosis based on recognizable fetal facial features and characteristic intracranial calcification.,"El-Dessouky SH, Abdel-Hamid MS, Abdel-Ghafar SF, Aboulghar MM, Gaafar HM, Fouad M, Ahmed AH, Abdel-Salam GMH",Prenatal diagnosis,2020/08/25,
32534992,Double heterozygous variants in FBN1 and FBN2 in a Thai woman with Marfan and Beals syndromes.,"Phokaew C, Sittiwangkul R, Suphapeetiporn K, Shotelersuk V",European journal of medical genetics,2020/06/15,
35023661,The rare reason of pain in hip girdle: Mucolipidosis type 3 gamma.,"Kolk?ran A, Karaosmano?lu B, Ta?k?ran ZE, ?im?ek-Kiper P?, Utine GE",The Turkish journal of pediatrics,2022/01/14,
34993029,Tetrasomy 18p Initially Misdiagnosed as Cerebral Palsy in an Adult Patient.,"Mehkri Y, Jules R, Elfasi A, Shuhaiber H",Cureus,2022/01/8,
34831818,Psychiatric Comorbidities in 1p36 Deletion Syndrome and Their Treatment-A Case Report.,Briegel W,International journal of environmental research and public health,2021/11/28,
34828665,Wiedemann-Steiner Syndrome with a Pathogenic Variant in KMT2A from Taiwan.,"Lee CL, Chuang CK, Chiu HC, Tu RY, Lo YT, Chang YH, Lin HY, Lin SP","Children (Basel, Switzerland)",2021/11/28,
34877573,Analysis of MYO1H Gene Polymorphism in Skeletal Class-III Malocclusion Due to Mandibular Prognathism.,"Atteeri A, Neela PK, Mamillapalli PK, Sesham VM, Keesara S, Chandra J, Monica U, Mohan V, Miryala S, Khan FA, Makthal P",Global medical genetics,2021/12/9,
34680978,Compound Heterozygote of Point Mutation and Chromosomal Microdeletion Involving OTUD6B Coinciding with ZMIZ1 Variant in Syndromic Intellectual Disability.,"Phetthong T, Khongkrapan A, Jinawath N, Seo GH, Wattanasirichaigoon D",Genes,2021/10/24,
34675602,A Novel Intronic KMT2D Variant as a Cause of Kabuki Syndrome: A Case Report.,"Aristiz¨¢bal E, Diaz-Ord¨®?ez L, Candelo E, Pachajoa H",The application of clinical genetics,2021/10/23,
34636477,Whole-exome sequencing identified first homozygous frameshift variant in the COLEC10 gene in an Iranian patient causing 3MC syndrome type 3.,"Mohammadi P, Salehi Siavashani E, Mohammadi MF, Bahramy A, Almadani N, Garshasbi M",Molecular genetics & genomic medicine,2021/10/13,
34622833,Novel WTX nonsense mutation in a family diagnosed with osteopathia striata with cranial sclerosis: Case report.,"Jeong C, Kim M, Yim J, Park IJ, Lee J, Lee J",Medicine,2021/10/9,
34602954,First Report of Two Egyptian Patients with Desbuquois Dysplasia due to Homozygous CANT1 Mutations.,"Thomas MM, Ashaat EA, Otaify GA, Ismail S, Essawi ML, Abdel-Hamid MS, Hassan HA, Alsaiedi SA, Aglan M, El Ruby MO, Temtamy S",Molecular syndromology,2021/10/5,
34552920,"Biallelic Mutations in ACACA Cause a Disruption in Lipid Homeostasis That Is Associated With Global Developmental Delay, Microcephaly, and Dysmorphic Facial Features.","Lou X, Zhou X, Li H, Lu X, Bao X, Yang K, Liao X, Chen H, Fang H, Yang Y, Lyu J, Zheng H",Frontiers in cell and developmental biology,2021/09/24,
34527642,A de novo Variant of ASXL1 Is Associated With an Atypical Phenotype of Bohring-Opitz Syndrome: Case Report and Literature Review.,"Zhao W, Hu X, Liu Y, Wang X, Chen Y, Wang Y, Zhou H",Frontiers in pediatrics,2021/09/17,
34484844,A Novel Mutation in the VPS13B Gene in a Cohen Syndrome Patient with Positive Antiphospholipid Antibodies.,"Dehghan R, Behnam M, Moafi A, Salehi M",Case reports in immunology,2021/09/7,
34466018,A Chinese Boy with Mowat-Wilson Syndrome Caused by a 10 bp Deletion in the ZEB2 Gene.,"Wei L, Han X, Li X, Han B, Nie W",Pharmacogenomics and personalized medicine,2021/09/2,
34461059,Identification of two novel homozygous mutations in ERCC8 gene in two unrelated consanguineous families with Cockayne syndrome from Iran.,"Yousefipour F, Mahjoobi F",Clinica chimica acta; international journal of clinical chemistry,2021/08/31,
34453476,Diverse clinical manifestations of Cant¨² syndrome: The first case series in Vietnam.,"Tran TNA, Phan HN, Vu HA, Nguyen HT",American journal of medical genetics. Part A,2021/08/29,
34419044,Identification of SOFT syndrome caused by a pathogenic homozygous splicing variant of POC1A: a case report.,"Li G, Chang G, Wang C, Yu T, Li N, Huang X, Wang X, Wang J, Wang J, Yao R",BMC medical genomics,2021/08/23,
34341476,PAX3/7-FOXO1 fusion-negative alveolar rhabdomyosarcoma in Schuurs-Hoeijmakers syndrome.,"Ohkawa T, Nishimura A, Kosaki K, Aoki-Nogami Y, Tomizawa D, Kashimada K, Morio T, Kato M, Mizutani S, Takagi M",Journal of human genetics,2021/08/4,
34259997,Non-lethal Raine Syndrome Report Lacking Characteristic Clinical Features.,"Ferreira LD, Leal GF, de Oliveira JRM",Journal of molecular neuroscience : MN,2021/07/15,
34252586,Further refining the critical region of 10q26 microdeletion syndrome: A possible involvement of INSYN2 and NPS in the cognitive phenotype.,"Cherik F, Lepage M, Remerand G, Francannet C, Delabaere A, Salaun G, Pebrel-Richard C, Gouas L, Vago P, Tchirkov A, Goumy C",European journal of medical genetics,2021/07/13,
34221169,New VOUS in CASK Gene Correlating with the MICPCH Phenotype.,"Shelby ES, Lupu OT, Axente M, Leanca MC, Badina M, Padure L, Mirea A, Pelttari LM",Maedica,2021/07/6,
34208845,Co-Occurring Heterozygous CNOT3 and SMAD6 Truncating Variants: Unusual Presentation and Refinement of the IDDSADF Phenotype.,"Priolo M, Radio FC, Pizzi S, Pintomalli L, Pantaleoni F, Mancini C, Cordeddu V, Africa E, Mamm¨¬ C, Dallapiccola B, Tartaglia M",Genes,2021/07/3,
34168676,"Genotype-Phenotype Associations in Patients With Type-1, Type-2, and Atypical NF1 Microdeletions.","B¨¹ki G, Zsigmond A, Czak¨® M, Szalai R, Antal G, Farkas V, Fekete G, Nagy D, Sz¨¦ll M, Tihanyi M, Melegh B, Hadzsiev K, Bene J",Frontiers in genetics,2021/06/26,
34112922,"Global developmental delay, systemic dysmorphism and epilepsy in a patient with a de novo U2AF2 variant.","Hiraide T, Tanaka T, Masunaga Y, Ohkubo Y, Nakashima M, Fukuda T, Ogata T, Saitsu H",Journal of human genetics,2021/06/12,
34098755,ALX-Related Frontonasal Dysplasias: Clinical Characteristics and Surgical Management.,"Vargel I, Canter HI, Kucukguven A, Aydin A, Ozgur F",The Cleft palate-craniofacial journal : official publication of the American Cleft Palate-Craniofacial Association,2021/06/9,
34084664,Homozygous Phosphatidylinositol Glycan Class T Mutation in an Indian Girl With Multiple Congenital Anomalies-Hypotonia-Seizures Syndrome 3.,"Sai Chandar D, Krishna Chaithanya B, Prashanthi M",Cureus,2021/06/5,
34068417,"CACNA1A Mutations Causing Early Onset Ataxia: Profiling Clinical, Dysmorphic and Structural-Functional Findings.","Mart¨ªnez-Monseny AF, Edo A, Casas-Alba D, Izquierdo-Serra M, Bolasell M, Conejo D, Martorell L, Muchart J, Carrera L, Ortez CI, Nascimento A, Oliva B, Fern¨¢ndez-Fern¨¢ndez JM, Serrano M",International journal of molecular sciences,2021/06/3,
34058530,De novo TCOF1 mutation in Treacher Collins syndrome.,"Liu J, Dong J, Li P, Duan W",International journal of pediatric otorhinolaryngology,2021/06/1,
34040419,A Review of Three Chinese Cases of Acromicric/Geleophysic Dysplasia with FBN1 Mutations.,"Shan YC, Yang ZC, Ma L, Ran N, Feng XY, Liu XM, Fu P, Yi MJ",International journal of general medicine,2021/05/28,
34038195,Identification of novel CSNK2A1 variants and the genotype-phenotype relationship in patients with Okur-Chung neurodevelopmental syndrome: a case report and systematic literature review.,"Wu RH, Tang WT, Qiu KY, Li XJ, Tang DX, Meng Z, He ZW",The Journal of international medical research,2021/05/27,
34037307,Expanding the genotypic spectrum of PYCR2 and a common ancestry in Thai patients with hypomyelinating leukodystrophy 10.,"Manaspon C, Boonsimma P, Phokaew C, Theerapanon T, Sriwattanapong K, Porntaveetus T, Shotelersuk V",American journal of medical genetics. Part A,2021/05/27,
34013494,More evidence on TRIO missense mutations in the spectrin repeat domain causing severe developmental delay and recognizable facial dysmorphism with macrocephaly.,"Kloth K, Graul-Neumann L, Hermann K, Johannsen J, Bierhals T, Kort¨¹m F",Neurogenetics,2021/05/21,
34012832,Comprehensive analysis of clinical spectrum and genotype associations in Chinese and literature reported KBG syndrome.,"Li Q, Sun C, Yang L, Lu W, Luo F",Translational pediatrics,2021/05/21,
34012383,"A Recurrent Variant in POLR1B, c.3007C>T; p.Arg1003Cys, Associated with Atresia of the External Canal and Microtia in Treacher Collins Syndrome Type 4.","Enomoto Y, Tsurusaki Y, Tominaga M, Kobayashi S, Inoue M, Fujita K, Kumaki T, Murakami H, Kurosawa K",Molecular syndromology,2021/05/21,
34012382,Kabuki Syndrome: Identification of Two Novel Variants in KMT2D and KDM6A.,"Khodaeian M, Jafarinia E, Bitarafan F, Shafeii S, Almadani N, Daneshmand MA, Garshasbi M",Molecular syndromology,2021/05/21,
33938623,Craniofacial features of 3q29 deletion syndrome: Application of next-generation phenotyping technology.,"Mak BC, Sanchez Russo R, Gambello MJ, Fleischer N, Black ED, Leslie E, Murphy MM, Emory 3q29 Project., Mulle JG",American journal of medical genetics. Part A,2021/05/4,
33930262,The MED13L haploinsufficiency syndrome associated with de novo nonsense variant (P.GLN1981*).,"Dawidziuk M, Kutkowska-Ka?mierczak A, Gawli¨½ski P, Wiszniewski W, Gos M, Stawi¨½ski P, Rydzanicz M, Kosi¨½ska J, W?asienko P, Malinowska Kordowska O, Bartnik-G?aska M, Bernaciak J, Szcza?uba K, Bekiesi¨½ska-Figatowska M, P?oski R, Bal J, Olimpia Rzo¨½ca-Niewczas S",Journal of mother and child,2021/05/1,
33909990,Truncating SRCAP variants outside the Floating-Harbor syndrome locus cause a distinct neurodevelopmental disorder with a specific DNA methylation signature.,"Rots D, Chater-Diehl E, Dingemans AJM, Goodman SJ, Siu MT, Cytrynbaum C, Choufani S, Hoang N, Walker S, Awamleh Z, Charkow J, Meyn S, Pfundt R, Rinne T, Gardeitchik T, de Vries BBA, Deden AC, Leenders E, Kwint M, Stumpel CTRM, Stevens SJC, Vermeulen JR, van Harssel JVT, Bosch DGM, van Gassen KLI, van Binsbergen E, de Geus CM, Brackel H, Hempel M, Lessel D, Denecke J, Slavotinek A, Strober J, Crunk A, Folk L, Wentzensen IM, Yang H, Zou F, Millan F, Person R, Xie Y, Liu S, Ousager LB, Larsen M, Schultz-Rogers L, Morava E, Klee EW, Berry IR, Campbell J, Lindstrom K, Pruniski B, Neumeyer AM, Radley JA, Phornphutkul C, Schmidt B, Wilson WG, ?unap K, Reinson K, Pajusalu S, van Haeringen A, Ruivenkamp C, Cuperus R, Santos-Simarro F, Palomares-Bralo M, Pacio-M¨ªguez M, Ritter A, Bhoj E, T?nne E, Tveten K, Cappuccio G, Brunetti-Pierri N, Rowe L, Bunn J, Saenz M, Platzer K, Mertens M, Caluseriu O, Nowaczyk MJM, Cohn RD, Kannu P, Alkhunaizi E, Chitayat D, Scherer SW, Brunner HG, Vissers LELM, Kleefstra T, Koolen DA, Weksberg R",American journal of human genetics,2021/04/29,
33810051,Shukla-Vernon Syndrome: A Second Family with a Novel Variant in the BCORL1 Gene.,"Muthusamy B, Bellad A, Girimaji SC, Pandey A",Genes,2021/04/4,
33768696,Genotype and phenotype in 18 Chinese patients with Coffin-Siris syndrome.,"Cheng SSW, Luk HM, Mok MT, Leung SS, Lo IFM",American journal of medical genetics. Part A,2021/03/27,
33765348,MASP1-related 3MC syndrome in a patient from Turkey.,"Durmaz CD, Alt?ner ?",American journal of medical genetics. Part A,2021/03/26,
33747040,Case Report: A Novel PAX3 Mutation Associated With Waardenburg Syndrome Type 1.,"Hu Q, Ma H, Shen J, Zhuang Z, Li J, Huang X, Li X, Li H",Frontiers in genetics,2021/03/23,
33743206,A DNA repair disorder caused by de novo monoallelic DDB1 variants is associated with a neurodevelopmental syndrome.,"White SM, Bhoj E, Nell?ker C, Lachmeijer AMA, Marshall AE, Boycott KM, Li D, Smith W, Hartley T, McBride A, Ernst ME, May AS, Wieczorek D, Abou Jamra R, Koch-Hogrebe M, ?unap K, Pajusalu S, van Gassen KLI, Sadedin S, Ellingwood S, Tan TY, Christodoulou J, Barea J, Lockhart PJ, Care4Rare Canada Consortium., Nezarati MM, Kernohan KD",American journal of human genetics,2021/03/21,
33730787,"Pseudohypoparathyroidism Type 1A with Normocalcaemia, due to the Novel C.389A&amp;gt;G Variant of Exon 5 of the Guanine Nucleotide-Binding Protein, ¦Á-Stimulating Gene.","Kotanidou EP, Tsinopoulou VR, Serbis A, Litou E, Galli-Tsinopoulou A",Journal of bone metabolism,2021/03/19,
33725872,Clinical assessment and FGFR2 mutation analysis in a Chinese family with Crouzon syndrome: A case report.,"Shi H, Yang J, Guo Q, Zhang M",Medicine,2021/03/18,
33717254,A novel combination of biallelic IFT122 variants associated with cranioectodermal dysplasia: A case report.,"Yang Q, Zhang Q, Chen F, Yi S, Li M, Yi S, Xu X, Luo J",Experimental and therapeutic medicine,2021/03/16,
33692830,The Intersection of the Genetic Architectures of Orofacial Clefts and Normal Facial Variation.,"Indencleef K, Hoskens H, Lee MK, White JD, Liu C, Eller RJ, Naqvi S, Wehby GL, Moreno Uribe LM, Hecht JT, Long RE Jr, Christensen K, Deleyiannis FW, Walsh S, Shriver MD, Richmond S, Wysocka J, Peeters H, Shaffer JR, Marazita ML, Hens G, Weinberg SM, Claes P",Frontiers in genetics,2021/03/12,
33676444,Recurrent variant c.1680C>A in FAM20C gene and genotype-phenotype correlation in a patient with Raine syndrome: a case report.,"Bajaj S, Nabi F, Shah J, Sheth H",BMC pediatrics,2021/03/8,
33652762,Two Italian Patients with ELOVL4-Related Neuro-Ichthyosis: ?Expanding the Genotypic and Phenotypic Spectrum and Ultrastructural Characterization.,"Diociaiuti A, Martinelli D, Nicita F, Cesario C, Pisaneschi E, Macchiaiolo M, Rossi S, Condorelli AG, Zambruno G, El Hachem M",Genes,2021/03/4,
33628537,Eye Manifestations of Shprintzen-Goldberg Craniosynostosis Syndrome: A Case Report and Systematic Review.,"Choi JH, Li R, Gannaway R, Causey TN, Harrison A, Couser NL",Case reports in genetics,2021/02/26,
33571694,"Hypersociability associated with developmental delay, macrocephaly and facial dysmorphism points to CHD3 mutations.","Coursimault J, Lecoquierre F, Saugier-Veber P, Drouin-Garraud V, Lechevallier J, Boland A, Deleuze JF, Frebourg T, Nicolas G, Brehin AC",European journal of medical genetics,2021/02/12,
33542958,Coexistence of bilateral macular edema and pale optic disc in the patient with Cohen syndrome.,"Rakusiewicz K, Kanigowska K, Hautz W, Wicher D, M?ynek M, Wyszy¨½ska M, Rogowska A, J?drzejczak-M?odziejewska J, Danowska M, Czeszyk A","Open medicine (Warsaw, Poland)",2021/02/6,
33522091,Phenotypic expansion of the BPTF-related neurodevelopmental disorder with dysmorphic facies and distal limb anomalies.,"Glinton KE, Hurst ACE, Bowling KM, Cristian I, Haynes D, Adstamongkonkul D, Schnappauf O, Beck DB, Brewer C, Parikh AS, Shinde DN, Donaldson A, Brautbar A, Koene S, van Haeringen A, Piton A, Capri Y, Furlan M, Gardella E, M?ller RS, van de Beek I, Zuurbier L, Lakeman P, Bayat A, Martinez J, Signer R, Torring PM, Engelund MB, Gripp KW, Amlie-Wolf L, Henderson LB, Midro AT, Taras¨®w E, Stasiewicz-Jarocka B, Moskal-Jasinska D, Vos P, Boschann F, Stoltenburg C, Puk O, Mero IL, Lossius K, Mignot C, Keren B, Acosta Guio JC, Brice?o I, Gomez A, Yang Y, Stankiewicz P",American journal of medical genetics. Part A,2021/02/2,
33510600,Clinical and Molecular Spectrum of Four Patients Diagnosed with Mowat-Wilson Syndrome.,"Ayyildiz Emecen D, Isik E, Utine GE, Simsek-Kiper PO, Atik T, Ozkinay F",Molecular syndromology,2021/01/30,
33510599,Phenotypic and Molecular Cytogenetic Analysis of a Case of Monosomy 1p36 Syndrome due to Unbalanced Translocation.,"Hussen DF, Kamel AK, Mekkawy MK, Ashaat EA, El Ruby MO",Molecular syndromology,2021/01/30,
33494996,"Tetrasomy of 11q13.4-q14.3 due to an intrachromosomal triplication associated with paternal uniparental isodisomy for 11q14.3-qter, intrauterine growth restriction, developmental delay, corpus callosum dysgenesis, microcephaly, congenital heart defects and facial dysmorphism.","Chen CP, Lin SP, Chern SR, Wu PS, Chen SW, Wu FT, Town DD, Wang W",Taiwanese journal of obstetrics & gynecology,2021/01/27,
33491997,Association of mutation in PTPN14 gene and gingival fibromatosis with distinctive facies: a novel finding in whole exome sequencing.,"Cogulu O, Mojarrab N, Simsir OS, Durmaz A, Aykut A, Cogulu D",Clinical dysmorphology,2021/01/26,
33466118,A novel mutation in RAB3GAP1 gene in Chinese patient causing the Warburg micro syndrome: A case report.,"Zhou D, Wang Q, Liu H",Medicine,2021/01/21,
33442026,"Biallelic truncating variants in MAPKAPK5 cause a new developmental disorder involving neurological, cardiac, and facial anomalies combined with synpolydactyly.","Horn D, Fern¨¢ndez-N¨²?ez E, Gomez-Carmona R, Rivera-Barahona A, Nevado J, Schwartzmann S, Ehmke N, Lapunzina P, Otaify GA, Temtamy S, Aglan M, Boschann F, Ruiz-Perez VL",Genetics in medicine : official journal of the American College of Medical Genetics,2021/01/15,
33422685,Mandibuloacral dysplasia type A in five tunisian patients.,"R S, H M, M T, A A, M G, I H, E K, K M, F M, R M",European journal of medical genetics,2021/01/11,
33392332,Novel mutation in the ASXL3 gene in a Chinese boy with microcephaly and speech impairment: A case report.,"Li JR, Huang Z, Lu Y, Ji QY, Jiang MY, Yang F",World journal of clinical cases,2021/01/5,
33369188,A 9-month-old Chinese patient with Gabriele-de Vries syndrome due to novel germline mutation in the YY1 gene.,"Tan L, Li Y, Liu F, Huang Y, Luo S, Zhao P, Gu W, Lin J, Zhou A, He X",Molecular genetics & genomic medicine,2020/12/29,
33356342,Novel Mutation in LARP7 in Two Iranian Consanguineous Families with Syndromic Intellectual Disability and Facial Dysmorphism.,"Kazemi G, Peymani F, Mohseni M, Zare Ashrafi F, Arzhangi S, Ardalani F, Aghakhani Moghaddam F, Kahrizi K, Najmabadi H",Archives of Iranian medicine,2020/12/29,
33341718,A novel nonsense mutation in the TCOF1 gene in one Chinese newborn with Treacher Collins syndrome.,"Zeng H, Xie M, Li J, Xie H, Lu X",International journal of pediatric otorhinolaryngology,2020/12/21,
33340101,Phenotypic spectrum of the RBM10-mediated intellectual disability and congenital malformation syndrome beyond classic TARP syndrome features.,"Kumps C, ""Dhaenens E"", Vergult S, Leus J, van Coster R, Jansen A, Devriendt K, Oostra A, Vanakker OM",Clinical genetics,2020/12/20,
33334799,The First Korean Case of Baraitser-Winter Cerebro-Fronto-Facial Syndrome with a Novel Mutation in ACTB Diagnosed Via Targeted Gene Panel Sequencing and Literature Review.,"Choi GJ, Kim MS, Park H, Kim JY, Choi JM, Lee SM, Jang JH, Cho SY, Jin DK",Annals of clinical and laboratory science,2020/12/19,
33325147,Trio-WES reveals a novel de novo missense mutation of KMT2A in a Chinese patient with Wiedemann-Steiner syndrome: A case report.,"Wang X, Zhang G, Lu Y, Luo X, Wu W",Molecular genetics & genomic medicine,2020/12/17,
33237614,Craniofacial phenotypes associated with Robinow syndrome.,"Conlon CJ, Abu-Ghname A, Raghuram AC, Davis MJ, Guillen DE, Sutton VR, Carvalho CMB, Maricevich RS",American journal of medical genetics. Part A,2020/11/26,
33231930,Gene-specific facial dysmorphism in Axenfeld-Rieger syndrome caused by FOXC1 and PITX2 variants.,"Souzeau E, Siggs OM, Pasutto F, Knight LSW, Perez-Jurado LA, McGregor L, Le Blanc S, Barnett CP, Liebelt J, Craig JE",American journal of medical genetics. Part A,2020/11/25,
33187326,7q11.23 Microduplication Syndrome: Clinical and Neurobehavioral Profiling.,"Dentici ML, Bergonzini P, Scibelli F, Caciolo C, De Rose P, Cumbo F, Alesi V, Capolino R, Zanni G, Sinibaldi L, Novelli A, Tartaglia M, Digilio MC, Dallapiccola B, Vicari S, Alfieri P",Brain sciences,2020/11/15,
33142042,Witteveen-Kolk syndrome: The first patient from Turkey.,"Ercoskun P, Yuce Kahraman C",American journal of medical genetics. Part A,2020/11/4,
33073934,TRPS1 mutation detection in Chinese patients with Tricho-rhino-phalangeal syndrome and identification of four novel mutations.,"Wang C, Xu Y, Qing Y, Yao R, Li N, Wang X, Yu T, Wang J",Molecular genetics & genomic medicine,2020/10/20,
33012048,Knockout of the gene encoding the extracellular matrix protein SNED1 results in early neonatal lethality and craniofacial malformations.,"Barqu¨¦ A, Jan K, De La Fuente E, Nicholas CL, Hynes RO, Naba A",Developmental dynamics : an official publication of the American Association of Anatomists,2020/10/5,
33002343,Further delineation of autosomal recessive intellectual disability syndrome caused by homozygous variant of the NSUN2 gene in a chinese pedigree.,"Sun S, Chen L, Wang Y, Wang J, Li N, Wang X",Molecular genetics & genomic medicine,2020/10/2,
32954677,Congenital diaphragmatic hernia as a prominent feature of a SPECC1L-related syndrome.,"Wild KT, Gordon T, Bhoj EJ, Du H, Jhangiani SN, Posey JE, Lupski JR, Scott DA, Zackai EH",American journal of medical genetics. Part A,2020/09/22,
32943010,A de novo synonymous variant in EFTUD2 disrupts normal splicing and causes mandibulofacial dysostosis with microcephaly: case report.,"Jacob A, Pasquier J, Carapito R, Aurad¨¦ F, Molitor A, Froguel P, Fakhro K, Halabi N, Viot G, Bahram S, Rafii A",BMC medical genetics,2020/09/19,
32935439,The first reported case of Loeys-Dietz syndrome in a patient with biallelic SMAD3 variants.,"Baskin SM, Morris SA, Vara A, Hecht JT, Farach LS",American journal of medical genetics. Part A,2020/09/17,
32926563,"A novel NFIA gene nonsense mutation in a Chinese patient with macrocephaly, corpus callosum hypoplasia, developmental delay, and dysmorphic features.","Zhang Y, Lin CM, Zheng XL, Abuduxikuer K",Molecular genetics & genomic medicine,2020/09/15,
32903913,Renpenning Syndrome in a Turkish Patient: de novo Variant c.607C>T in PACS1 and Hypogammaglobulinemia Phenotype.,"Kurt Colak F, Eyerci N, Aytekin C, Eksioglu AS",Molecular syndromology,2020/09/10,
32902151,The first familial case of inherited intellectual developmental disorder with dysmorphic facies and behavioral abnormalities (IDDFBA) with a novel FBXO11 variant.,"Lee CG, Seol CA, Ki CS",American journal of medical genetics. Part A,2020/09/10,
32872024,Exon 21 deletion in the OPHN1 gene in a family with syndromic X-linked intellectual disability: Case report.,"Bogli? A, Cosma AS, Tripon F, B?nescu C",Medicine,2020/09/3,
32839936,A Novel CREBBP in-Frame Deletion Variant in a Chinese Girl with Atypical Rubinstein-Taybi Syndrome Phenotypes.,"Wang Q, Xu W, Liu Y, Yuan H",Journal of molecular neuroscience : MN,2020/08/26,
32798076,Tremor as an early sign of hereditary spastic paraplegia due to mutations in ALDH18A1.,"Kalm¨¢r T, Mar¨®ti Z, Zimmermann A, Sztriha L",Brain & development,2020/08/17,
32765932,Peruvian Newborn Male with 3p13 Deletion Syndrome Encompassing the FOXP1 Gene: Review of the Literature.,"Abarca-Barriga HH, Trubnykova M, Chavesta-Vel¨¢squez F, Barletta-Carrillo C, Ordo?ez-Linares M, Rond¨®n-Abuhadba A",Journal of pediatric genetics,2020/08/9,
32740552,MITF Is Mutated in Type 1 Waardenburg Syndrome With Unusual Phenotype.,"Li W, Feng Y, Chen H, He C, Mei L, Liu XZ, Men M","Otology & neurotology : official publication of the American Otological Society, American Neurotology Society [and] European Academy of Otology and Neurotology",2020/08/3,
32737394,"Biallelic ZNF407 mutations in a neurodevelopmental disorder with ID, short stature and variable microcephaly, hypotonia, ocular anomalies and facial dysmorphism.","Zahra Q, ?akmak ?, Koprulu M, Shuaib M, Sobreira N, Kalsner L, Sobreira J, Guillen Sacoto MJ, Malik S, Tolun A",Journal of human genetics,2020/08/2,
32733715,Chromosome 20p Partial De Novo Duplication Identified in a Female Paediatric Patient with Characteristic Facial Dysmorphism and Behavioural Anomalies.,"Khattak S, Jan M, Warsi S, Khattak S",Case reports in genetics,2020/08/1,
32707268,"Multisystem disorders, severe developmental delay and seizures in two affected siblings, expanding the phenotype of PIGC deficiency.","Pons L, Sabatier I, Alix E, Faoucher M, Labalme A, Sanlaville D, Lesca G",European journal of medical genetics,2020/07/25,
32688057,Clinical and molecular description of 19 patients with GATAD2B-Associated Neurodevelopmental Disorder (GAND).,"Vera G, Sorlin A, Delplancq G, Lecoquierre F, Brasseur-Daudruy M, Petit F, Smol T, Ziegler A, Bonneau D, Colin E, Mercier S, Cogn¨¦ B, B¨¦zieau S, Edery P, Lesca G, Chatron N, Sabatier I, Duban-Bedu B, Colson C, Piton A, Durand B, Capri Y, Perrin L, Wiesener A, Zweier C, Maroofian R, Carroll CJ, Galehdari H, Mazaheri N, Callewaert B, Giulianno F, Zaafrane-Khachnaoui K, Buchert-Lo R, Haack T, Magg J, Rie? A, Blandfort M, Waldm¨¹ller S, Horber V, Leonardi E, Polli R, Turolla L, Murgia A, Frebourg T, Lebre AS, Nicolas G, Saugier-Veber P, Guerrot AM",European journal of medical genetics,2020/07/21,
32659295,BCL11B-related disorder in two canadian children: Expanding the clinical phenotype.,"Prasad M, Balci TB, Prasad C, Andrews JD, Lee R, Jurkiewicz MT, Napier MP, Colaiacovo S, Guillen Sacoto MJ, Karp N",European journal of medical genetics,2020/07/14,
32618029,Coffin-Siris syndrome with bilateral macular dysplasia caused by a novel exonic deletion in ARID1B.,"Fujita T, Ihara Y, Hayashi H, Ishii A, Ideguchi H, Inoue T, Imaizumi T, Yamamoto T, Hirose S",Congenital anomalies,2020/07/4,
32615693,Effects of long-term growth hormone therapy in a girl with Floating-Harbor syndrome.,"Son HW, Lee JE, Oh SH, Keum C, Chung WY",Annals of pediatric endocrinology & metabolism,2020/07/4,
32537934,Extension of the phenotypic spectrum of GLE1-related disorders to a mild congenital form resembling congenital myopathy.,"Cerino M, Di Meglio C, Albertini F, Audic F, Riccardi F, Boulay C, Philip N, Bartoli M, L¨¦vy N, Krahn M, Chabrol B",Molecular genetics & genomic medicine,2020/06/17,
