pmid,article_name,author,magazine_name,publish_time,
28687524,Pierpont syndrome associated with the p.Tyr446Cys missense mutation in TBL1XR1.,"Slavotinek A, Pua H, Hodoglugil U, Abadie J, Shieh J, Van Ziffle J, Kvale M, Lee H, Kwok PY, Risch N, Sabbadini M",European journal of medical genetics,2017/07/9,
28645799,Genotype-phenotype evaluation of MED13L defects in the light of a novel truncating and a recurrent missense mutation.,"Asadollahi R, Zweier M, Gogoll L, Schiffmann R, Sticht H, Steindl K, Rauch A",European journal of medical genetics,2017/06/25,
28611923,A novel UBE2A mutation causes X-linked intellectual disability type Nascimento.,"Tsurusaki Y, Ohashi I, Enomoto Y, Naruto T, Mitsui J, Aida N, Kurosawa K",Human genome variation,2017/06/15,
28544239,A novel variant in MED12 gene: Further delineation of phenotype.,"Narayanan DL, Phadke SR",American journal of medical genetics. Part A,2017/05/26,
28521875,"Exome sequencing reveals a de novo POLD1 mutation causing phenotypic variability in mandibular hypoplasia, deafness, progeroid features, and lipodystrophy syndrome (MDPL).","Elouej S, Beleza-Meireles A, Caswell R, Colclough K, Ellard S, Desvignes JP, B¨¦roud C, L¨¦vy N, Mohammed S, De Sandre-Giovannoli A",Metabolism: clinical and experimental,2017/05/20,
28480548,"Expanding the phenotypic spectrum of truncating POGZ mutations: Association with CNS malformations, skeletal abnormalities, and distinctive facial dysmorphism.","Dentici ML, Niceta M, Pantaleoni F, Barresi S, Bencivenga P, Dallapiccola B, Digilio MC, Tartaglia M",American journal of medical genetics. Part A,2017/05/10,
28468609,A novel TRPS1 mutation in a Moroccan family with Tricho-rhino-phalangeal syndrome type III: case report.,"Smaili W, Elalaoui SC, Meier S, Zerkaoui M, Sefiani A, Heinimann K",BMC medical genetics,2017/05/5,
28449295,KBG syndrome: An Australian experience.,"Murray N, Burgess B, Hay R, Colley A, Rajagopalan S, McGaughran J, Patel C, Enriquez A, Goodwin L, Stark Z, Tan T, Wilson M, Roscioli T, Tekin M, Goel H",American journal of medical genetics. Part A,2017/04/28,
28411391,Phenotypic expression of 19q13.32 microdeletions: Report of a new patient and review of the literature.,"Travan L, Naviglio S, De Cunto A, Pellegrin A, Pecile V, Spinelli AM, Cappellani S, Faletra F",American journal of medical genetics. Part A,2017/04/16,
28390064,PGAP3-related hyperphosphatasia with mental retardation syndrome: Report of 10 new patients and a homozygous founder mutation.,"Abdel-Hamid MS, Issa MY, Otaify GA, Abdel-Ghafar SF, Elbendary HM, Zaki MS",Clinical genetics,2017/04/9,
28316926,Apert syndrome with S252W FGFR2 mutation and characterization using Phenomizer: An Indian case report.,"Kunwar F, Tewari S, Bakshi SR",Journal of oral biology and craniofacial research,2017/03/21,
28276056,Second family provides further evidence for causation of Steel syndrome by biallelic mutations in COL27A1.,"Kotabagi S, Shah H, Shukla A, Girisha KM",Clinical genetics,2017/03/10,
28139846,Genotype and phenotype in 12 additional individuals with SATB2-associated syndrome.,"Zarate YA, Kalsner L, Basinger A, Jones JR, Li C, Szybowska M, Xu ZL, Vergano S, Caffrey AR, Gonzalez CV, Dubbs H, Zackai E, Millan F, Telegrafi A, Baskin B, Person R, Fish JL, Everman DB",Clinical genetics,2017/02/1,
28017373,"Mutations in EBF3 Disturb Transcriptional Profiles and Cause Intellectual Disability, Ataxia, and Facial Dysmorphism.","Harms FL, Girisha KM, Hardigan AA, Kort¨¹m F, Shukla A, Alawi M, Dalal A, Brady L, Tarnopolsky M, Bird LM, Ceulemans S, Bebin M, Bowling KM, Hiatt SM, Lose EJ, Primiano M, Chung WK, Juusola J, Akdemir ZC, Bainbridge M, Charng WL, Drummond-Borg M, Eldomery MK, El-Hattab AW, Saleh MAM, B¨¦zieau S, Cogn¨¦ B, Isidor B, K¨¹ry S, Lupski JR, Myers RM, Cooper GM, Kutsche K",American journal of human genetics,2016/12/27,
27964710,First case report of inherited Rubinstein-Taybi syndrome associated with a novel EP300 variant.,"L¨®pez M, Seidel V, Santib¨¢?ez P, Cervera-Acedo C, Castro-de Castro P, Dom¨ªnguez-Garrido E",BMC medical genetics,2016/12/15,
27882258,Dysmorphic Facial Features and Other Clinical Characteristics in Two Patients with PEX1 Gene Mutations.,"Gunduz M, Unal O",Case reports in pediatrics,2016/11/25,
27880953,Deletion of TOP3B Is Associated with Cognitive Impairment and Facial Dysmorphism.,"Kaufman CS, Genovese A, Butler MG",Cytogenetic and genome research,2016/11/24,
27803855,FGFR2 mutation in a Chinese family with unusual Crouzon syndrome.,"Li ZL, Chen X, Zhuang WJ, Zhao W, Liu YN, Zhang FX, Ha RS, Wu JH, Zhao C, Sheng XL",International journal of ophthalmology,2016/11/3,
27796265,A Rare Cause of Short Stature: 3M Syndrome in a Patient with Novel Mutation in OBSL1 Gene.,"Keskin M, Murato?lu ?ahin N, Kurnaz E, Bayramo?lu E, Sava? Erdeve ?, Aycan Z, ?etinkaya S",Journal of clinical research in pediatric endocrinology,2016/11/1,
27777327,Wiedemann-Steiner Syndrome With 2 Novel KMT2A Mutations.,"Min Ko J, Cho JS, Yoo Y, Seo J, Choi M, Chae JH, Lee HR, Cho TJ",Journal of child neurology,2016/11/1,
27751966,"Concurrent occurrence of an inherited 16p13.11 microduplication and a de novo 19p13.3 microdeletion involving MAP2K2 in a patient with developmental delay, distinctive facial features, and lambdoid synostosis.","Shimojima K, Ondo Y, Matsufuji M, Sano N, Tsuru H, Oyoshi T, Higa N, Tokimura H, Arita K, Yamamoto T",European journal of medical genetics,2016/10/25,
27591971,A rare occurrence of two large de novo duplications on 1q42-q44 and 9q21.12-q21.33.,"Wang J, Fu C, Zhang S, Luo J, Ouyang L, Xie B, Sun W, He S, Su J, Hu X, Fei D, Chen R, Fan X, Ou S, Chen S, Shen Y",Gene,2016/09/7,
27570168,"A novel familial autosomal dominant mutation in ARID1B causing neurodevelopmental delays, short stature, and dysmorphic features.","Smith JA, Holden KR, Friez MJ, Jones JR, Lyons MJ",American journal of medical genetics. Part A,2016/08/30,
27430617,Molecular analysis of FGFR 2 and associated clinical observations in two Chinese families with Crouzon syndrome.,"Lin Y, Gao H, Ai S, Eswarakumar JV, Li T, Liu B, Jiang H, Liu Y, Liu X, Li Y, Ni Y, Chen J, Lin Z, Liang X, Jin C, Huang X, Lu L, Liu Y",Molecular medicine reports,2016/07/20,
27416976,Nine year old boy with chromosome 1q23.3-q25.1 deletion.,"Lam F, Morris C",American journal of medical genetics. Part A,2016/07/16,
27385966,A New Case of an Extremely Rare 3p21.31 Interstitial Deletion.,"Lovrecic L, Bertok S, ?erjav Tan?ek M",Molecular syndromology,2016/07/8,
27374896,A novel 5q11.2 microdeletion in a child with mild developmental delay and dysmorphic features.,"Fontana P, Tortora C, Petillo R, Falco M, Miniero M, De Brasi D, Pisanti MA",American journal of medical genetics. Part A,2016/07/5,
27324866,Exome sequencing revealed a novel splice site variant in the ALX1 gene underlying frontonasal dysplasia.,"Ullah A, Kalsoom UE, Umair M, John P, Ansar M, Basit S, Ahmad W",Clinical genetics,2016/06/22,
27311832,CREBBP mutations in individuals without Rubinstein-Taybi syndrome phenotype.,"Menke LA, van Belzen MJ, Alders M, Cristofoli F, DDD Study, Ehmke N, Fergelot P, Foster A, Gerkes EH, Hoffer MJ, Horn D, Kant SG, Lacombe D, Leon E, Maas SM, Melis D, Muto V, Park SM, Peeters H, Peters DJ, Pfundt R, van Ravenswaaij-Arts CM, Tartaglia M, Hennekam RC",American journal of medical genetics. Part A,2016/06/18,
27247625,"A novel de novo microdeletion at 17q11.2 adjacent to NF1 gene associated with developmental delay, short stature, microcephaly and dysmorphic features.","Xie B, Fan X, Lei Y, Chen R, Wang J, Fu C, Yi S, Luo J, Zhang S, Yang Q, Chen S, Shen Y",Molecular cytogenetics,2016/06/2,
27164845,A Familial 14q32.32q32.33 Duplication/17p13.3 Deletion Syndrome with Facial Anomalies and Moderate Intellectual Disability.,"He C, Dong C, Li J, Hu D, Yao L, Wu Y",Cytogenetic and genome research,2016/05/12,
27148679,"An emerging, recognizable facial phenotype in association with mutations in GLI-similar 3 (GLIS3).","Dimitri P, De Franco E, Habeb AM, Gurbuz F, Moussa K, Taha D, Wales JK, Hogue J, Slavotinek A, Shetty A, Balasubramanian M",American journal of medical genetics. Part A,2016/05/6,
27148580,"De novo pathogenic variants in CHAMP1 are associated with global developmental delay, intellectual disability, and dysmorphic facial features.","Tanaka AJ, Cho MT, Retterer K, Jones JR, Nowak C, Douglas J, Jiang YH, McConkie-Rosell A, Schaefer GB, Kaylor J, Rahman OA, Telegrafi A, Friedman B, Douglas G, Monaghan KG, Chung WK",Cold Spring Harbor molecular case studies,2016/05/6,
27108999,A splice site mutation in HERC1 leads to syndromic intellectual disability with macrocephaly and facial dysmorphism: Further delineation of the phenotypic spectrum.,"Aggarwal S, Bhowmik AD, Ramprasad VL, Murugan S, Dalal A",American journal of medical genetics. Part A,2016/04/26,
27091925,"A recurrent mitochondrial p.Trp22Arg NDUFB3 variant causes a distinctive facial appearance, short stature and a mild biochemical and clinical phenotype.","Alston CL, Howard C, Ol¨¢hov¨¢ M, Hardy SA, He L, Murray PG, ""OSullivan S"", Doherty G, Shield JP, Hargreaves IP, Monavari AA, Knerr I, McCarthy P, Morris AA, Thorburn DR, Prokisch H, Clayton PE, McFarland R, Hughes J, Crushell E, Taylor RW",Journal of medical genetics,2016/04/20,
27075689,Novel splicing mutation in the ASXL3 gene causing Bainbridge-Ropers syndrome.,"Hori I, Miya F, Ohashi K, Negishi Y, Hattori A, Ando N, Okamoto N, Kato M, Tsunoda T, Yamasaki M, Kanemura Y, Kosaki K, Saitoh S",American journal of medical genetics. Part A,2016/04/15,
26893599,Identification of 1p36 deletion syndrome in patients with facial dysmorphism and developmental delay.,"Seo GH, Kim JH, Cho JH, Kim GH, Seo EJ, Lee BH, Choi JH, Yoo HW",Korean journal of pediatrics,2016/02/20,
26842963,ADAT3-related intellectual disability: Further delineation of the phenotype.,"El-Hattab AW, Saleh MA, Hashem A, Al-Owain M, Asmari AA, Rabei H, Abdelraouf H, Hashem M, Alazami AM, Patel N, Shaheen R, Faqeih EA, Alkuraya FS",American journal of medical genetics. Part A,2016/02/5,
26842493,Clinical delineation of the PACS1-related syndrome--Report on 19 patients.,"Schuurs-Hoeijmakers JH, Landsverk ML, Foulds N, Kukolich MK, Gavrilova RH, Greville-Heygate S, Hanson-Kahn A, Bernstein JA, Glass J, Chitayat D, Burrow TA, Husami A, Collins K, Wusik K, van der Aa N, Kooy F, Brown KT, Gadzicki D, Kini U, Alvarez S, Fern¨¢ndez-Ja¨¦n A, McGehee F, Selby K, Tarailo-Graovac M, Van Allen M, van Karnebeek CD, Stavropoulos DJ, Marshall CR, Merico D, Gregor A, Zweier C, Hopkin RJ, Chu YW, Chung BH, de Vries BB, Devriendt K, Hurles ME, Brunner HG, DDD study",American journal of medical genetics. Part A,2016/02/5,
26834018,Novel 14q11.2 microduplication including the CHD8 and SUPT16H genes associated with developmental delay.,"Smyk M, Poluha A, Jaszczuk I, Bartnik M, Bernaciak J, Nowakowska B",American journal of medical genetics. Part A,2016/02/3,
26759605,"A rare de novo interstitial duplication of 15q15.3q21.2 in a boy with severe short stature, hypogonadism, global developmental delay and intellectual disability.","Yuan H, Meng Z, Zhang L, Luo X, Liu L, Chen M, Li X, Zhao W, Liang L",Molecular cytogenetics,2016/01/14,
26647099,Triplication of 16p12.1p12.3 associated with developmental and growth delay and distinctive facial features.,"Nimmo GA, Guerin A, Badilla-Porras R, Stavropoulos DJ, Yoon G, Carter MT",American journal of medical genetics. Part A,2015/12/10,
26603346,Identification of a novel de novo mutation of CREBBP in a patient with Rubinstein-Taybi syndrome by targeted next-generation sequencing: a case report.,"Kamenarova K, Simeonov E, Tzveova R, Dacheva D, Penkov M, Kremensky I, Perenovska P, Mitev V, Kaneva R",Human pathology,2015/11/26,
26551301,Revealing the function of a novel splice-site mutation of CHD7 in CHARGE syndrome.,"Lee B, Duz MB, Sagong B, Koparir A, Lee KY, Choi JY, Seven M, Yuksel A, Kim UK, Ozen M",Gene,2015/11/10,
26269715,An interstitial deletion at 8q23.1-q24.12 associated with Langer-Giedion syndrome/ Trichorhinophalangeal syndrome (TRPS) type II and Cornelia de Lange syndrome 4.,"Selenti N, Tzetis M, Braoudaki M, Gianikou K, Kitsiou-Tzeli S, Fryssira H",Molecular cytogenetics,2015/08/14,
26264232,"WAC loss-of-function mutations cause a recognisable syndrome characterised by dysmorphic features, developmental delay and hypotonia and recapitulate 10p11.23 microdeletion syndrome.","DeSanto C, ""DAco K"", Araujo GC, Shannon N, DDD Study, Vernon H, Rahrig A, Monaghan KG, Niu Z, Vitazka P, Dodd J, Tang S, Manwaring L, Martir-Negron A, Schnur RE, Juusola J, Schroeder A, Pan V, Helbig KL, Friedman B, Shinawi M",Journal of medical genetics,2015/08/13,
26236398,A recurrent deletion on chromosome 2q13 is associated with developmental delay and mild facial dysmorphisms.,"Hladilkova E, Bar?y T, Fannemel M, Vallova V, Misceo D, Bryn V, Slamova I, Prasilova S, Kuglik P, Frengen E",Molecular cytogenetics,2015/08/4,
26180728,Isolated Sagittal Synostosis in a Boy with Craniofrontonasal Dysplasia and a Novel EFNB1 Mutation.,"Chauhan BK, Hoover JM, Scanga H, Medsinge A, Arnold GL, Nischal KK",Plastic and reconstructive surgery. Global open,2015/07/17,
26086840,"A homozygous B3GAT3 mutation causes a severe syndrome with multiple fractures, expanding the phenotype of linkeropathy syndromes.","Jones KL, Schwarze U, Adam MP, Byers PH, Mefford HC",American journal of medical genetics. Part A,2015/06/19,
26082802,"Evidence that homozygous PTPRD gene microdeletion causes trigonocephaly, hearing loss, and intellectual disability.","Choucair N, Mignon-Ravix C, Cacciagli P, Abou Ghoch J, Fawaz A, M¨¦garban¨¦ A, Villard L, Chouery E",Molecular cytogenetics,2015/06/18,
26059428,Identification of a Mutation in FGF23 Involved in Mandibular Prognathism.,"Chen F, Li Q, Gu M, Li X, Yu J, Zhang YB",Scientific reports,2015/06/11,
26033841,"De Novo 17q24.2-q24.3 microdeletion presenting with generalized hypertrichosis terminalis, gingival fibromatous hyperplasia, and distinctive facial features.","Afifi HH, Fukai R, Miyake N, Gamal El Din AA, Eid MM, Eid OM, Thomas MM, El-Badry TH, Tosson AM, Abdel-Salam GM, Matsumoto N",American journal of medical genetics. Part A,2015/06/3,
25979662,Brain malformations in a patient with deletion 2p16.1: A refinement of?the phenotype to BCL11A.,"Balci TB, Sawyer SL, Davila J, Humphreys P, Dyment DA",European journal of medical genetics,2015/05/17,
25945256,3-M syndrome: a novel CUL7 mutation associated with respiratory distress and a good response to GH therapy.,"Deeb A, Afandi O, Attia S, Fatih AE","Endocrinology, diabetes & metabolism case reports",2015/05/7,
25944381,"DYRK1A haploinsufficiency causes a new recognizable syndrome with microcephaly, intellectual disability, speech impairment, and distinct facies.","Ji J, Lee H, Argiropoulos B, Dorrani N, Mann J, Martinez-Agosto JA, Gomez-Ospina N, Gallant N, Bernstein JA, Hudgins L, Slattery L, Isidor B, Le Caignec C, David A, Obersztyn E, Wi?niowiecka-Kowalnik B, Fox M, Deignan JL, Vilain E, Hendricks E, Horton Harr M, Noon SE, Jackson JR, Wilkens A, Mirzaa G, Salamon N, Abramson J, Zackai EH, Krantz I, Innes AM, Nelson SF, Grody WW, Quintero-Rivera F",European journal of human genetics : EJHG,2015/05/7,
25900906,Microdeletion 1p35.2: a recognizable facial phenotype with developmental delay.,"Wilson BT, Omer M, Hellens SW, Zwolinski SA, Yates LM, Lynch SA",American journal of medical genetics. Part A,2015/04/23,
25900396,Delineation of the KIAA2022 mutation phenotype: two patients with X-linked intellectual disability and distinctive features.,"Kuroda Y, Ohashi I, Naruto T, Ida K, Enomoto Y, Saito T, Nagai J, Wada T, Kurosawa K",American journal of medical genetics. Part A,2015/04/23,
25898976,Clinical characterization of a male patient with the recently described 8q21.11 microdeletion syndrome.,"Quintela I, Barros F, Castro-Gago M, Carracedo A, Eiris J",American journal of medical genetics. Part A,2015/04/23,
25845712,12q21.2q22 deletion: a new patient.,"Oliveira R, Pereira C, Melo JB, Mesquita S, Venancio M, Carreira IM, Saraiva J",American journal of medical genetics. Part A,2015/04/8,
25839420,"Mutations in XRCC4 cause primary microcephaly, short stature and increased genomic instability.","Rosin N, Elcioglu NH, Beleggia F, Isg¨¹ven P, Altm¨¹ller J, Thiele H, Steindl K, Joset P, Rauch A, N¨¹rnberg P, Wollnik B, Yigit G",Human molecular genetics,2015/04/4,
25774220,Report of a patient and further clinical and molecular characterization of interstitial 4p16.3 microduplication.,"Palumbo O, Palumbo P, Ferri E, Riviello FN, Cloroformio L, Carella M, Di Giacomo MC",Molecular cytogenetics,2015/03/17,
25772936,Mutations in the endothelin receptor type A cause mandibulofacial dysostosis with alopecia.,"Gordon CT, Weaver KN, Zechi-Ceide RM, Madsen EC, Tavares AL, Oufadem M, Kurihara Y, Adameyko I, Picard A, Breton S, Pierrot S, Biosse-Duplan M, Voisin N, Masson C, Bole-Feysot C, Nitschk¨¦ P, Delrue MA, Lacombe D, Guion-Almeida ML, Moura PP, Garib DG, Munnich A, Ernfors P, Hufnagel RB, Hopkin RJ, Kurihara H, Saal HM, Weaver DD, Katsanis N, Lyonnet S, Golzio C, Clouthier DE, Amiel J",American journal of human genetics,2015/03/17,
25755819,Novel mutation of RUNX2 gene in a patient with cleidocranial dysplasia.,"Guo YW, Chiu CY, Liu CL, Jap TS, Lin LY",International journal of clinical and experimental pathology,2015/03/11,
25728777,Dominant mutations in KAT6A cause intellectual disability with recognizable syndromic features.,"Tham E, Lindstrand A, Santani A, Malmgren H, Nesbitt A, Dubbs HA, Zackai EH, Parker MJ, Millan F, Rosenbaum K, Wilson GN, Nordgren A",American journal of human genetics,2015/03/3,
25712080,Novel de novo heterozygous loss-of-function variants in MED13L and further delineation of the MED13L haploinsufficiency syndrome.,"Cafiero C, Marangi G, Orteschi D, Ali M, Asaro A, Ponzi E, Moncada A, Ricciardi S, Murdolo M, Mancano G, Contaldo I, Leuzzi V, Battaglia D, Mercuri E, Slavotinek AM, Zollino M",European journal of human genetics : EJHG,2015/02/26,
25433523,Expanded spectrum of exon 33 and 34 mutations in SRCAP and follow-up in patients with Floating-Harbor syndrome.,"Seifert W, Meinecke P, Kr¨¹ger G, Rossier E, Heinritz W, W¨¹sthof A, Horn D",BMC medical genetics,2014/12/1,
25426167,Interstitial 14q24.3 to q31.3 deletion in a 6-year-old boy with a non-specific dysmorphic phenotype.,"Riegel M, Moreira LM, Espirito Santo LD, Toralles MB, Schinzel A",Molecular cytogenetics,2014/11/27,
25424714,Further delineation of the KBG syndrome phenotype caused by ANKRD11 aberrations.,"Ockeloen CW, Willemsen MH, de Munnik S, van Bon BW, de Leeuw N, Verrips A, Kant SG, Jones EA, Brunner HG, van Loon RL, Smeets EE, van Haelst MM, van Haaften G, Nordgren A, Malmgren H, Grigelioniene G, Vermeer S, Louro P, Ramos L, Maal TJ, van Heumen CC, Yntema HG, Carels CE, Kleefstra T",European journal of human genetics : EJHG,2014/11/27,
25388005,"A syndrome of congenital microcephaly, intellectual disability and dysmorphism with a homozygous mutation in FRMD4A.","Fine D, Flusser H, Markus B, Shorer Z, Gradstein L, Khateeb S, Langer Y, Narkis G, Birk R, Galil A, Shelef I, Birk OS",European journal of human genetics : EJHG,2014/11/13,
25387991,Phenotype analysis of Polish patients with mandibulofacial dysostosis type Guion-Almeida associated with esophageal atresia and choanal atresia caused by EFTUD2 gene mutations.,"Smigiel R, Bezniakow N, Jakubiak A, B?och M, Patkowski D, Obersztyn E, Sasiadek MM",Journal of applied genetics,2014/11/13,
25337073,A novel (paternally inherited) duplication 13q31.3q32.3 in a 12-year-old patient with facial dysmorphism and developmental delay.,"Atack E, Fairtlough H, Smith K, Balasubramanian M",Molecular syndromology,2014/10/23,
25187894,A de novo microdeletion of ANKRD11 gene in a Korean patient with KBG syndrome.,"Lim JH, Seo EJ, Kim YM, Cho HJ, Lee JO, Cheon CK, Yoo HW",Annals of laboratory medicine,2014/09/5,
25177352,A novel TRPS1 gene mutation causing trichorhinophalangeal syndrome with growth hormone responsive short stature: a case report and review of the literature.,"Merjaneh L, Parks JS, Muir AB, Fadoju D",International journal of pediatric endocrinology,2014/09/2,
25045128,Whole exome sequencing identifies three novel mutations in ANTXR1 in families with GAPO syndrome.,"Bayram Y, Pehlivan D, Karaca E, Gambin T, Jhangiani SN, Erdin S, Gonzaga-Jauregui C, Wiszniewski W, Muzny D, Baylor-Hopkins Center for Mendelian Genomics, Elcioglu NH, Yildirim MS, Bozkurt B, Zamani AG, Boerwinkle E, Gibbs RA, Lupski JR",American journal of medical genetics. Part A,2014/07/22,
33569240,A Multivariate Approach to Determine the Dimensionality of Human Facial Asymmetry,"Omid Ekrami , Peter Claes , Julie D White , Seth M Weinberg , Mary L Marazita , Susan Walsh , Mark D Shriver , Stefan Van Dongen",Symmetry,2021/02/12,
24919122,Craniofrontonasal Syndrome: Atrial Septal Defect With a Novel EFNB1 Gene Mutation.,"Goyal M, Pradhan G, Wieland I, Kapoor S",The Cleft palate-craniofacial journal : official publication of the American Cleft Palate-Craniofacial Association,2014/06/12,
24911659,"Haploinsufficiency of XPO1 and USP34 by a de novo 230?kb deletion in 2p15, in a patient with mild intellectual disability and cranio-facial dysmorphisms.","Fannemel M, Bar?y T, Holmgren A, R?dningen OK, Haugsand TM, Hansen B, Frengen E, Misceo D",European journal of medical genetics,2014/06/10,
24838992,A child with split-hand/foot associated with tibial hemimelia (SHFLD syndrome) and thrombocytopenia maps to chromosome region 17p13.3.,"Al Kaissi A, Ganger R, R?tzer KM, Klaushofer K, Grill F",American journal of medical genetics. Part A,2014/05/20,
24768550,"Mutations in ASPH cause facial dysmorphism, lens dislocation, anterior-segment abnormalities, and spontaneous filtering blebs, or Traboulsi syndrome.","Patel N, Khan AO, Mansour A, Mohamed JY, Al-Assiri A, Haddad R, Jia X, Xiong Y, M¨¦garban¨¦ A, Traboulsi EI, Alkuraya FS",American journal of human genetics,2014/04/29,
24764207,A novel mutation in the EDAR gene causes severe autosomal recessive hypohidrotic ectodermal dysplasia.,"Henningsen E, Svendsen MT, Lildballe DL, Jensen PK",American journal of medical genetics. Part A,2014/04/26,
24700674,Autosomal recessive spastic tetraplegia caused by AP4M1 and AP4B1 gene mutation: expansion of the facial and neuroimaging features.,"T¨¹ys¨¹z B, Bilguvar K, Ko?er N, Yal??nkaya C, ?a?layan O, G¨¹l E, Sahin S, ?omu S, G¨¹nel M",American journal of medical genetics. Part A,2014/04/5,
24697219,"De novo EEF1A2 mutations in patients with characteristic facial features, intellectual disability, autistic behaviors and epilepsy.","Nakajima J, Okamoto N, Tohyama J, Kato M, Arai H, Funahashi O, Tsurusaki Y, Nakashima M, Kawashima H, Saitsu H, Matsumoto N, Miyake N",Clinical genetics,2014/04/5,
24664804,"A newly recognized 13q12.3 microdeletion syndrome characterized by intellectual disability, microcephaly, and eczema/atopic dermatitis encompassing the HMGB1 and KATNAL1 genes.","Bartholdi D, Stray-Pedersen A, Azzarello-Burri S, Kibaek M, Kirchhoff M, Oneda B, R?dningen O, Schmitt-Mechelke T, Rauch A, Kjaergaard S",American journal of medical genetics. Part A,2014/03/26,
24656633,Clinical features in adult patient with Wolf-Hirschhorn syndrome.,"Mart¨ªnez-Quintana E, Rodr¨ªguez-Gonz¨¢lez F",Morphologie : bulletin de l'Association des anatomistes,2014/03/25,
24615390,Expanding the clinical and mutational spectrum of Kaufman oculocerebrofacial syndrome with biallelic UBE3B mutations.,"Basel-Vanagaite L, Yilmaz R, Tang S, Reuter MS, Rahner N, Grange DK, Mortenson M, Koty P, Feenstra H, Farwell Gonzalez KD, Sticht H, Boddaert N, D¨¦sir J, Anyane-Yeboa K, Zweier C, Reis A, Kubisch C, Jewett T, Zeng W, Borck G",Human genetics,2014/03/13,
24508941,Three novel GJA1 missense substitutions resulting in oculo-dento-digital dysplasia (ODDD) - further extension of the mutational spectrum.,"Jamsheer A, Sowi¨½ska-Seidler A, Socha M, Stembalska A, Kiraly-Borri C, Latos-Biele¨½ska A",Gene,2014/02/11,
24462886,Clinical assessment of five patients with BRWD3 mutation at Xq21.1 gives further evidence for mild to moderate intellectual disability and macrocephaly.,"Grotto S, Drouin-Garraud V, Ounap K, Puusepp-Benazzouz H, Schuurs-Hoeijmakers J, Le Meur N, Chambon P, Fehrenbach S, van Bokhoven H, Fr¨¦bourg T, de Brouwer AP, Saugier-Veber P",European journal of medical genetics,2014/01/28,
24440292,A complex microcephaly syndrome in a Pakistani family associated with a novel missense mutation in RBBP8 and a heterozygous deletion in NRXN1.,"Agha Z, Iqbal Z, Azam M, Siddique M, Willemsen MH, Kleefstra T, Zweier C, de Leeuw N, Qamar R, van Bokhoven H",Gene,2014/01/21,
