pmid,article_name,author,magazine_name,publish_time,
35401677,Identification of a De Novo Heterozygous Missense ACTB Variant in Baraitser-Winter Cerebrofrontofacial Syndrome.,"Nie K, Huang J, Liu L, Lv H, Chen D, Fan W",Front Genet,2022/04/12,
35397152,"Microcornea, iris and choroidal coloboma, and global developmental delay caused by TENM3 pathogenic variants in a Chinese patient.","Zhou Y, Xu K, Gu W, Huang Y",Mol Genet Genomic Med,2022/04/10,
35395430,Clinical and molecular delineation of mandibulofacial dysostosis with microcephaly in six Korean patients: When to consider EFTUD2 analysis?,"Ryu JH, Kim HY, Ko JM, Kim MJ, Seong MW, Choi BY, Chae JH",Eur J Med Genet,2022/04/9,
35386616,First documented case of Myhre syndrome in Romania: A case report.,"C?tan? A, Simonescu-Colan R, Cuzmici-Baraba? Z, Militaru D, Iord?nescu I, Militaru MS",Exp Ther Med,2022/04/8,
35368703,"Novel Loss-of-Function Mutations in NPR2 Cause Acromesomelic Dysplasia, Maroteaux Type.","Wu J, Wang M, Jiao Z, Dou B, Li B, Zhang J, Zhang H, Sun Y, Tu X, Kong X, Bai Y",Front Genet,2022/04/5,
35344616,Phenotypic and mutational spectrum of ROR2-related Robinow syndrome.,"Lima AR, Ferreira BM, Zhang C, Jolly A, Du H, White JJ, Dawood M, Lins TC, Chiabai MA, van Beusekom E, Cordoba MS, Caldas Rosa ECC, Kayserili H, Kimonis V, Wu E, Mellado C, Aggarwal V, Richieri-Costa A, Brunoni D, Can¨® TM, Jorge AAL, Kim CA, Honjo R, Bertola DR, Dandalo-Girardi RM, Bayram Y, Gezdirici A, Yilmaz-Gulec E, Gumus E, Yilmaz GC, Okamoto N, Ohashi H, Coban-Akdemir Z, Mitani T, Jhangiani SN, Muzny DM, Regattieri NAP, Pogue R, Pereira RW, Otto PA, Gibbs RA, Ali BR, van Bokhoven H, Brunner HG, Sutton VR, Lupski JR, Vianna-Morgante AM, Carvalho CMB, Mazzeu JF",Hum Mutat,2022/03/29,
35338599,Two Japanese patients with Noonan syndrome-like disorder with loose anagen hair 2.,"Maruwaka K, Nakajima Y, Yamada T, Tanaka T, Kosaki R, Inagaki H, Kosaki K, Kurahashi H",Am J Med Genet A,2022/03/27,
35332702,Clinical observation and genetic analysis of a SYNS1 family caused by novel NOG gene mutation.,"Zhang Z, Lu Y, Cao JY, Wang L, Li LK, Wang C, Ye X, Ji YM, Tu LY, Sun Y",Mol Genet Genomic Med,2022/03/26,
35327965,Variable Anterior Segment Dysgenesis and Cardiac Anomalies Caused by a Novel Truncating Variant of FOXC1.,"Ahmed MR, Sethna S, Krueger LA, Yang MB, Hufnagel RB",Genes (Basel),2022/03/26,
35321723,Identification of a novel compound heterozygous SMG9 variants in a Chinese family with heart and brain malformation syndrome using whole exome sequencing.,"Yang Q, Qin Z, Zhang Q, Yi S, Yi S, Luo J",BMC Med Genomics,2022/03/25,
35304602,Biallelic PAN2 variants in individuals with a syndromic neurodevelopmental disorder and multiple congenital anomalies.,"Reuter MS, Zech M, Hempel M, Altm¨¹ller J, Heung T, P?lsler L, Santer R, Thiele H, Trost B, Kubisch C, Scherer SW, Rudnik-Sch?neborn S, Bassett AS, Lessel D",Eur J Hum Genet,2022/03/20,
35298084,"Microcephalic primordial dwarfism with predominant Meier-Gorlin phenotype, ichthyosis, and multiple joint deformities-Further expansion of DONSON Cell Cycle-opathy phenotypic spectrum.","Nerakh G, Vineeth VS, Tallapaka K, Nair L, Dalal A, Aggarwal S",Am J Med Genet A,2022/03/18,
35276034,De novo nonsense variant in ASXL3 in a Chinese girl causing Bainbridge-Ropers syndrome: A case report and review of literature.,"Wang Q, Zhang J, Jiang N, Xie J, Yang J, Zhao X",Mol Genet Genomic Med,2022/03/12,
35246174,"Bi-allelic mutation of CTNNB1 causes a severe form of syndromic microphthalmia, persistent foetal vasculature and vitreoretinal dysplasia.","Taylor RL, Soriano CS, Williams S, Dzulova D, Ashworth J, Hall G, Gale T, Lloyd IC, Inglehearn CF, Toomes C, Douzgou S, Black GC",Orphanet J Rare Dis,2022/03/6,
35243762,"BRPF1-associated syndrome: A patient with congenital ptosis, neurological findings, and normal intellectual development.","Souza J, do Valle DA, Santos MLSF, Colom¨¦ FB, Teive HAG, da Silva Freitas R, Herai RH",Am J Med Genet A,2022/03/5,
35237736,Novel KDM6A Kabuki Syndrome Mutation With Hyperinsulinemic Hypoglycemia and Pulmonary Hypertension Requiring ECMO.,"Salguero MV, Chan K, Greeley SAW, Dyamenahalli U, Waggoner D, Del Gaudio D, Rajiyah T, Lemelman M",J Endocr Soc,2022/03/4,
35229282,"A homozygous frame-shift variant in PROSER1 is associated with developmental delay, hypotonia, genitourinary malformations, and distinctive facial features.","Salah A, Almannai M, Al Ojaimi M, Radefeldt M, Gulati N, Iqbal M, Alawbathani S, Al-Ali R, Beetz C, El-Hattab AW",Clin Genet,2022/03/2,
35224863,Two novel variants in SCARF2 gene underlie van den Ende-Gupta syndrome.,"Karaer D, Karaer K",Am J Med Genet A,2022/03/1,
35222542,Case Report: A Novel Mutation in the CRYGD Gene Causing Congenital Cataract Associated with Nystagmus in a Chinese Family.,"Gao Y, Ren X, Fu X, Lin Y, Xiao L, Wang X, Yan N, Zhang M",Front Genet,2022/03/1,
35205281,The Role of the Disrupted Podosome Adaptor Protein (SH3PXD2B) in Frank-Ter Haar Syndrome.,"Massadeh S, Alhabshan F, AlSudairi HN, Alkwai S, Alsuwailm M, Kabbani MS, Chaikhouni F, Alaamery M",Genes (Basel),2022/02/26,
35196747,Novel RAB3GAP1 Mutation in the First Tunisian Family With Warburg Micro Syndrome.,"Kerkeni N, Kharrat M, Maazoul F, Boudabous H, ""Mrad R"", Trabelsi M",J Clin Neurol,2022/02/24,
35189377,Disruption and deletion of the proximal part of TCF4 are associated with mild intellectual disability: About three new patients.,"Masson J, Pons L, Busa T, Missirian C, Lines M, Tevissen H, Diguet F, Rollat-Farnier PA, Lesca G, Sanlaville D, Schluth-Bolard C",Eur J Med Genet,2022/02/22,
35182808,A recessive variant in SIM2 in a child with complex craniofacial anomalies and global developmental delay.,"Al-Kurbi AA, ""Daas SI"", Aamer W, Krishnamoorthy N, Poggiolini I, Abdelrahman D, Elbashir N, Al-Shabeeb Akil A, Glass GE, Fakhro KA",Eur J Med Genet,2022/02/20,
35182806,A de novo and novel nonsense variants in ASXL2 gene is associated with Shashi-Pena syndrome.,"Jiao Z, Zhao X, Wang Y, Wei E, Mei S, Liu N, Kong X, Shi H",Eur J Med Genet,2022/02/20,
35174115,Andersen-Tawil Syndrome With Novel Mutation in KCNJ2: Case Report.,"Yim J, Kim KB, Kim M, Lee GD, Kim M",Front Pediatr,2022/02/18,
35169780,Rare Findings in Cleidocranial Dysplasia Caused by RUNX Mutation.,"Kalayci Yigin A, Duz MB, Seven M",Glob Med Genet,2022/02/17,
35156329,Expanding the mutational spectrum of Rahman syndrome: A rare disorder with severe intellectual disability and particular facial features in two Chinese patients.,"Zhao J, Lyu G, Ding C, Wang X, Li J, Zhang W, Yang X, Zhang VW",Mol Genet Genomic Med,2022/02/15,
35150935,3M syndrome: A Tunisian seven-cases series.,"Khachnaoui-Zaafrane K, Ouertani I, Zanati A, Kandara H, Maazoul F, Mrad R",Eur J Med Genet,2022/02/13,
35150469,Novel homozygous nonsynonymous variant of CNNM4 gene in a Chinese family with Jalili syndrome.,"Li H, Huang Y, Li J, Xie M",Mol Genet Genomic Med,2022/02/13,
35091509,Inherited and de novo variants extend the etiology of TAOK1-associated neurodevelopmental disorder.,"Hunter JM, Massingham LJ, Manickam K, Bartholomew D, Williamson RK, Schwab JL, Marhabaie M, Siemon A, de Los Reyes E, Reshmi SC, Cottrell CE, Wilson RK, Koboldt DC",Cold Spring Harb Mol Case Stud,2022/01/30,
35084103,A truncating variant in the THOC6 gene with new findings in a patient with Beaulieu-Boycott-Innes syndrome.,"Kiraz A, Tuba? F, Seber T",Am J Med Genet A,2022/01/28,
35080105,SHORT syndrome in an adult Brazilian patient.,"Gon?alves ACG, Moretti PN, Cordoba MS, Oliveira RS, Lopes FSC, Oliveira SF, Pic-Taylor A, Castro LC, Mazzeu JF",Am J Med Genet A,2022/01/27,
35052432,"A Novel GEMIN4 Variant in a Consanguineous Family Leads to Neurodevelopmental Impairment with Severe Microcephaly, Spastic Quadriplegia, Epilepsy, and Cataracts.","Aldhalaan H, AlBakheet A, AlRuways S, AlMutairi N, AlNakiyah M, AlGhofaili R, Cardona-Londo?o KJ, Alahmadi KO, AlQudairy H, AlRasheed MM, Colak D, Arold ST, Kaya N",Genes (Basel),2022/01/22,
35042684,Novel ADAMTSL4 gene mutations in Chinese patients with isolated ectopia lentis.,"Guo D, Yang F, Zhou Y, Zhang X, Cao Q, Jin G, Zheng D",Br J Ophthalmol,2022/01/20,
35034608,Detection of a novel PAX6 variant in a Chinese family with multiple ocular abnormalities.,"Ouyang J, Cai Z, Guo Y, Nie F, Cao M, Duan X",BMC Ophthalmol,2022/01/18,
35034425,Genetic of preimplantation diagnosis of dysmorphic facial features and intellectual developmental disorder (CHDFIDD) without congenital heart defects.,"Cui X, Wu X, Wang H, Zhang S, Wang W, Jing X",Mol Genet Genomic Med,2022/01/17,
34997803,Congenital heart defects associated with pathogenic variants in WAC gene: Expanding the phenotypic and genotypic spectrum of DeSanto-Shinawi syndrome.,"Quental R, Gon?alves D, Rodrigues E, Serrano Gon?alves E, Oliveira J, Parente Freixo J, Le?o M",Am J Med Genet A,2022/01/9,
34988992,A new phenotype of syndromic retinitis pigmentosa with myopathy is caused by mutations in retinol dehydrogenase 11.,"Liu YD, Huang SS, Li M, Lek M, Song DY, Tan DD, Chen XY, Zhang H, Liu JY, Chang XZ, Xiong H",Clin Genet,2022/01/7,
34966851,ITGB5 mutation discovered in a Chinese family with blepharophimosis-ptosis-epicanthus inversus syndrome.,"Cheng T, Yuan X, Yuan S, Zhu J, Tang S, Zhang Y",Open Life Sci,2021/12/31,
34925453,Spondyloocular Syndrome: A Novel XYLT2 Variant with Description of the Neonatal Phenotype.,"Doddato G, Fabbiani A, Fallerini C, Bruttini M, Hadjistilianou T, Landi M, Coradeschi C, Grosso S, Tomasini B, Mencarelli MA, Renieri A, Ariani F",Front Genet,2021/12/21,
34906488,Elucidating the clinical spectrum and molecular basis of HYAL2 deficiency.,"Fasham J, Lin S, Ghosh P, Radio FC, Farrow EG, Thiffault I, Kussman J, Zhou D, Hemming R, Zahka K, Chioza BA, Rawlins LE, Wenger OK, Gunning AC, Pizzi S, Onesimo R, Zampino G, Barker E, Osawa N, Rodriguez MC, Neuhann TM, Zackai EH, Keena B, Capasso J, Levin AV, Bhoj E, Li D, Hakonarson H, Wentzensen IM, Jackson A, Chandler KE, Coban-Akdemir ZH, Posey JE, Banka S, Lupski JR, Sheppard SE, Tartaglia M, Triggs-Raine B, Crosby AH, Baple EL",Genet Med,2021/12/16,
34898996,Identification of a Novel VPS13B Mutation in a Chinese Patient with Cohen Syndrome by Whole-Exome Sequencing.,"Hu X, Huang T, Liu Y, Zhang L, Zhu L, Peng X, Zhang S",Pharmgenomics Pers Med,2021/12/14,
34894068,"Vein of Galen aneurysm, dilated cardiomyopathy, and slender habitus in a patient with a recurrent pathogenic variant in PACS2.","Valenzuela I, Guill¨¦n Ben¨ªtez E, Sanchez-Montanez A, Limeres J, L¨®pez-Grondona F, Cusc¨® I, Tizzano EF",Am J Med Genet A,2021/12/12,
34877407,Novel Variations in the KDM5C Gene Causing X-Linked Intellectual Disability.,"Wu PM, Yu WH, Chiang CW, Wu CY, Chen JS, Tu YF",Neurol Genet,2021/12/9,
34799960,First case report of Penttinen syndrome from India.,"Aggarwal B, Correa ARE, Gupta N, Jana M, Kabra M",Am J Med Genet A,2021/11/21,
34797033,"De novo PBX1 variant in a patient with glaucoma, kidney anomalies, and developmental delay: An expansion of the CAKUTHED phenotype.","Safgren SL, Olson RJ, Pinto E Vairo F, Bothun ED, Hanna C, Klee EW, Schimmenti LA",Am J Med Genet A,2021/11/20,
34750959,A new case of Turnpenny-Fry syndrome.,"Ercoskun P, Yuce Kahraman C, Adanur Saglam K, Kanjee M, Tatar A",Am J Med Genet A,2021/11/10,
34713892,Expanding the genotypic spectrum of TXNL4A variants in Burn-McKeown syndrome.,"Wood KA, Ellingford JM, Thomas HB, Genomics UK Research Consortium, Douzgou S, Beaman GM, Hobson E, Prescott K, ""OKeefe RT"", Newman WG",Clin Genet,2021/10/30,
34623732,INTU-related oral-facial-digital syndrome XVII: Clinical spectrum of a rare disorder.,"Yakar O, Tatar A",Am J Med Genet A,2021/10/9,
34580982,A monoallelic SEC23A variant E599K associated with cranio-lenticulo-sutural dysplasia.,"Cisarova K, Garavelli L, Caraffi SG, Peluso F, Valeri L, Gargano G, Gavioli S, Trimarchi G, Neri A, Campos-Xavier B, Superti-Furga A",Am J Med Genet A,2021/09/29,
33827296,A novel missense mutation of CRYBA1 in a northern Chinese family with inherited coronary cataract with blue punctate opacities.,"Ni SH, Zhang JM, Zhao J",Eur J Ophthalmol,2021/04/9,
36111181,A Novel Variant and a Missense Variant Identified in the DKC1 Gene in Three Chinese Familieswith Dyskeratosis Congenita.,"Yuan C, Deng D, Yang J, Liu S, Qian Q, Chen M, Zhou S, Li Y, Li M",Clin Cosmet Investig Dermatol,2022/09/17,
36890748,Solitary median maxillary central incisor in Kabuki syndrome 2 with novel missense mutation of KDM6A and ABCC8 genes.,"Rihani FB, Altayeh MM, Al-Kilani RZ, Alrejjal RA",J Clin Pediatr Dent,2023/03/10,
35674542,"Cleidocranial dysplasia and novel RUNX2 variants: dental, craniofacial, and osseous manifestations.","Thaweesapphithak S, Saengsin J, Kamolvisit W, Theerapanon T, Porntaveetus T, Shotelersuk V",J Appl Oral Sci,2022/06/9,
35278031,Bruck syndrome in 13 new patients: Identification of five novel FKBP10 and PLOD2 variants and further expansion of the phenotypic spectrum.,"Otaify GA, Abdel-Hamid MS, Hassib NF, Elhossini RM, Abdel-Ghafar SF, Aglan MS",Am J Med Genet A,2022/03/13,
36552944,A Novel CDH1 Variant Identified in a Chinese Family with Blepharocheilodontic Syndrome.,"Lin B, Liu Y, Su L, Liu H, Feng H, Yu M, Liu H",Diagnostics (Basel),2022/12/24,
35714441,Novel DLX3 variant identified in a family with tricho-dento-osseous syndrome.,"Liu H, Wang Y, Liu H, Yu M, Zheng J, Feng H, Liu Y, Han D",Arch Oral Biol,2022/06/18,
36836560,Novel WDR72 Mutations Causing Hypomaturation Amelogenesis Imperfecta.,"Kim YJ, Zhang H, Lee Y, Seymen F, Koruyucu M, Kasimoglu Y, Simmer JP, Hu JC, Kim JW",J Pers Med,2023/02/26,
36183038,Enamel defects in Acp4(R110C/R110C) mice and human ACP4 mutations.,"Liang T, Wang SK, Smith C, Zhang H, Hu Y, Seymen F, Koruyucu M, Kasimoglu Y, Kim JW, Zhang C, Saunders TL, Simmer JP, Hu JC",Sci Rep,2022/10/2,
36937962,Case report: A preterm infant with rubinstein-taybi syndrome and Marmorata telangiectatica harboring a frameshift mutation in the CREBBP gene,"Yang Yang, Jing Xiao, Yuanyuan Ye, Jianwen Xiang, Zhu Wang, Jia Chen",Front Pediatr,2023/03/3,
36833282,"Whole Exome Sequencing Reveals a Novel Homozygous Variant in the Ganglioside Biosynthetic Enzyme, ST3GAL5 Gene in a Saudi Family Causing Salt and Pepper Syndrome","Angham Abdulrhman Abdulkareem, Bader H. Shirah, and Muhammad Imran Naseer",Genes (Basel),2023/01/30,
36833254,Autistic Behavior as Novel Clinical Finding in OFD1 Syndrome,"Sorina Mihaela Papuc, Alina Erbescu, Adelina Glangher, Ioana Streata, Anca-Lelia Riza, Magdalena Budisteanu, Aurora Arghir",Genes (Basel),2023/01/27,
36802310,Clinical features of CNOT3-associated neurodevelopmental disorder in three Chinese patients,"Peiwei Zhao, Qingjie Meng, Chunhui Wan, Tao Lei, Lei Zhang, Xiankai Zhang, Li Tan, Hongmin Zhu, Xuelian He",Neurogenetics,2023/02/21,
36778913,Case report: 7p22.3 deletion and 8q24.3 duplication in a patient with epilepsy and psychomotor delay-Does both possibly act to modulate a candidate gene region for the patient's phenotype?,"Rahma Touhami, Hajer Foddha, Eudeline Alix, Afef Jalloul, Soumaya Mougou-Zerelli, Ali Saad, Damien Sanlaville, Amel Haj Khelil",Front Genet,2023/01/9,
36777706,"De novo Pure Partial Trisomy 6p Associated with Facial Dysmorphism, Developmental Delay, Brain Anomalies, and Primary Congenital Hypothyroidism","Ayberk T¨¹rky?lmaz, Emine Ay?a Cimbek, Alper Han ?ebi, Elif Acar Arslan, G¨¹lay Karag¨¹ze",Mol Syndromol,2022/07/6,
36757831,The clinical and genetic spectrum of autosomal-recessive TOR1A-related disorders,"Afshin Saffari, Tracy Lau, Homa Tajsharghi, Ehsan Ghayoor Karimiani, Ariana Kariminejad, Stephanie Efthymiou, Giovanni Zifarelli, Tipu Sultan, Mehran Beiraghi Toosi, Sahar Sedighzadeh, Victoria Mok Siu, Juan Dar¨ªo Ortigoza-Escobar, Aisha M AlShamsi, Shahnaz Ibrahim, Nouriya Abbas Al-Sannaa, Walla Al-Hertani, Whalen Sandra, Mark Tarnopolsky, Shahryar Alavi, Chumei Li, Debra-Lynn Day-Salvatore, Maria Jes¨²s Mart¨ªnez-Gonz¨¢lez, Kristin M Levandoski, Emma Bedoukian, Suneeta Madan-Khetarpal, Michaela J Idleburg, Minal Juliet Menezes, Aishwarya Siddharth, Konrad Platzer, Henry Oppermann, Martin Smitka, Felicity Collins, Monkol Lek, Mohmmad Shahrooei, Maryam Ghavideldarestani, Isabella Herman, John Rendu, Julien Faure, Janice Baker, Vikas Bhambhani, Laurel Calderwood, Javad Akhondian, Shima Imannezhad, Hanieh Sadat Mirzadeh, Narges Hashemi, Mohammad Doosti, Mojtaba Safi, Najmeh Ahangari, Paria Najarzadeh Torbati, Soheila Abedini, Vincenzo Salpietro, Elif Yilmaz Gulec, Safieh Eshaghian, Mohammadreza Ghazavi, Michael T Pascher, Marina Vogel, Angela Abicht, S¨¦bastien Moutton, Ange-Line Bruel, Claudine Rieubland, Sabina Gallati, Tim M Strom, Hanns Lochm¨¹ller, Mohammad Hasan Mohammadi, Javeria Raza Alvi, Elaine H Zackai, Beth A Keena, Cara M Skraban, Seth I Berger, Erin H Andrew, Elham Rahimian, Michelle M Morrow, Ingrid M Wentzensen, Francisca Millan, Lindsay B Henderson, Hormos Salimi Dafsari, Heinz Jungbluth, Natalia Gomez-Ospina, Anne McRae, Merlene Peter, Danai Veltra, Nikolaos M Marinakis, Christalena Sofocleous, Farah Ashrafzadeh, Davut Pehlivan, Johannes R Lemke, Judith Melki, Audrey Benezit, Peter Bauer, Denisa Weis, James R Lupski, Jan Senderek, John Christodoulou, Wendy K Chung, Rose Goodchild, Amaka C Offiah, Andres Moreno-De-Luca, Mohnish Suri, Darius Ebrahimi-Fakhari, Henry Houlden, and Reza Maroofian",Brain,2023/08/1,
36757469,Two patients with KDM3B variants and new presentations of Diets¨CJongmans syndrome,"Xiangyue Zhao, Tingting Yu, Jie Tang, Ru-en Yao, Niu Li & Jian Wang",Neurogenetics,2023/02/9,
36731504,"A Korean boy with a CHD8 mutation who presented with overgrowth, intellectual disability, and autism","Chiwoo Kim, Min-Sun Kim, Eu-seon Noh, Ga young Bae, Ja-Hyun Jang, Sae-Mi Lee, Sung Yoon Cho, Jeehun Lee, Dong-Kyu Jin",Ann Pediatr Endocrinol Metab,2023/02/1,
36726590,PHIP-associated Chung-Jansen syndrome: Report of 23 new individuals,"Antje Kampmeier,corresponding author ,Elsa Leit?o, 1 Ilaria Parenti, Jasmin Beygo, Christel Depienne, Nuria C Bramswig, Tzung-Chien Hsieh, Alexandra Afenjar, Stefanie Beck-W?dl, Ute Grasshoff, Tobias B Haack, Emilia K Bijlsma, Claudia Ruivenkamp, Eva Lausberg, Miriam Elbracht, Maria K Haanp??,Hannele Koillinen,Uwe Heinrich, Imma Rost, Rami Abou Jamra, Denny Popp, Margarete Koch-Hogrebe,Kevin Rostasy,Vanesa L¨®pez-Gonz¨¢lez, 14 Mar¨ªa Jos¨¦ Sanchez-Soler, Catarina Macedo, Ariane Schmetz, Carmen Steinborn, Sabine Weidensee, Hellen Lesmann, Felix Marbach, Pilar Caro, Christian P. Schaaf, Peter Krawitz, Dagmar Wieczorek , Frank J Kaiser, and Alma Kuechlercorresponding author ",Front Cell Dev Biol,2023/01/16,
36692708,"A Homozygous PPP1R21 Splice Variant Associated with Severe Developmental Delay, Absence of Speech, and Muscle Weakness Leads to Activated Proteasome Function","Andreas Hentschel,Nancy Meyer,Nicolai Kohlschmidt,Claudia Gro?,Albert Sickmann,Ulrike Schara-Schmidt,Fabian F?rster,Ana T?pf,Jon Christiansen,Rita Horvath,Matthias Vorgerd,Rachel Thompson,Kiran Polavarapu,Hanns Lochm¨¹ller,Corinna Preusse,Luis Hannappel,Anne Sch?nzer,Anika Gr¨¹neboom,Andrea Gangfu?,and Andreas Roos",Mol Neurobiol,2023/04/24,
36685875,Case report: Craniofrontonasal syndrome caused by a novel variant in the EFNB1 gene in a Colombian woman,"Harry Pachajoa,corresponding author,Diana Marcela Vasquez-Forero, and Sebastian Giraldo-Ocampo ",Front Genet,2023/01/4,
36660029,"Typical Face, Developmental Delay, and Hearing Loss in a Patient with 3M Syndrome: The Co-Occurrence of Two Rare Conditions","Ak?ahan Akal?n , Pelin ?. ?im?ek-Kiper, Ekim Ta?k?ran, G¨¹len E. Utine, and Koray Boduro?lu ",Mol Syndromol,2023/01/13,
36605301,"Deletion in the BCL11B Gene and Intellectual Developmental Disorder with Speech Delay, Dysmorphic Facies, and T-cell Abnormalities ¨C a Case Report","Adriel Roa-Bautista,corresponding author, M¨®nica L¨®pez-Duarte, Nerea Paz-Gandiaga,David San Segundo Arribas,and J. Gonzalo Ocejo-Vinyals ",EJIFCC,2022/12/12,
36588753,Growth Hormone Deficiency due to p.(Gln467Argfs*64) Mutation in the ARID1B Gene in a Girl with Coffin-Siris Syndrome,"Stella Mouskou,* Sofia Leka-Emiri, Anastasia Korona,Sotiria Mastroyanni,Emmanouil Manolakos,Ioannis Papoulidis,Nick Sekouris,Adamantios Katerelos,Efstathia Katsarou-Pectasides,and Konstantinos Voudris",Mol Syndromol,2022/04/8,
36564961,KBG syndrome: Clinical features and molecular findings in seven unrelated Korean families with a review of the literature,"Yunha Choi, Jungmin Choi, Hyosang Do, Soojin Hwang, Go Hun Seo, In Hee Choi, Changwon Keum, Jin-Ho Choi, Minji Kang, Gu-Hwan Kim, Han-Wook Yoo, Beom Hee Lee",Mol Genet Genomic Med,2023/04/11,
36553519,"Clinical, Radiological, and Genetic Characterization of a Patient with a Novel Homoallelic Loss-of-Function Variant in DNM1","Ruqaiah AlTassan, Hanan AlQudairy, Rakan Alromayan, Abdullah Alfalah, Omar A AlHarbi, Ana C Gonz¨¢lez-¨¢lvarez, Stefan T Arold, Namik Kaya",Genes (Basel).,2022/11/30,
36531959,"Clinical and molecular characteristics of a novel rare de novo variant in PPP2CA in a patient with a developmental disorder, autism, and epilepsy","Iris Verbinnen, Sara S Procknow, Lisa Lenaerts, Sara Reynhout, Aujan Mehregan, Chris Ulens, Veerle Janssens, Katherine A King",Front Cell Dev Biol,2022/11/30,
36470856,"Novel BCL11B truncation variant in a patient with developmental delay, distinctive features, and early craniosynostosis",Hum Genome Var,"Kaoru Eto, Osamu Machida, Tomoe Yanagishita, Keiko Shimojima Yamamoto, Kentaro Chiba, Yasuo Aihara, Yuuki Hasegawa, Miho Nagata, Yasuki Ishihara, Yohei Miyashita, Yoshihiro Asano, Satoru Nagata, Toshiyuki Yamamoto",2022/12/5,
36345475,Mowat-Wilson Syndrome as a Differential Diagnosis in Patients with Congenital Heart Defects and Dysmorphic Facies,"Pachajoa H, Gomez-Pineda E, Giraldo-Ocampo S, Lores J.",Pharmgenomics Pers Med,2022/11/1,
36330313,Identification of a New Variant of the MBTPS1 Gene of the Kondo-Fu Type of Spondyloepiphyseal Dysplasia (SEDKF) in a Saudi Patient. Case Rep Pediatr,"Alotaibi M, Aldossari A, Khan I, Alotaibi L.",Case Rep Pediatr,2022/10/25,
36292677,Phenotypic Spectrum and Molecular Findings in 17 ATR-X Syndrome Italian Patients: Some New Insights.,"Vaisfeld A, Taormina S, Simonati A, Neri G.",Genes (Basel).,2022/10/13,
36275919,Novel Synonymous and Frameshift Variants in the TRIP12 Gene Identified in 2 Chinese Patients With Intellectual Disability.,"Yi S, Chen F, Qin Z, Yi S, Huang L, Huang L, Feng Y, Wei H, Yang Q, Zhang Q, Luo J.",Neurol Genet.,2022/10/20,
36274669,A novel de novo pathogenic variant in KDM3B gene at the first Albanian case of Diets-Jongmans syndrome: DIJOS.,"Tabaku M, Tomori S, Cullufi P, Dervishi E, Paknia O, Bauer P.",Mol Genet Metab Rep.,2022/10/14,
36176959,Identification of two novel variants of the BCL11B gene in two Chinese pedigrees associated with neurodevelopmental disorders. Front Mol Neurosci.,"Che F, Tie X, Lei H, Zhang X, Duan M, Zhang L, Yang Y.",Front Mol Neurosci ,2022/09/13,
36147799,"Yang H, Liu Z, Chen D, Lin W, Wang L, Chen T, Wang R, Yan X.","Yang H, Liu Z, Chen D, Lin W, Wang L, Chen T, Wang R, Yan X.",Front Pediatr.,2022/09/6,
36090579,Case report: A study on the de novo KMT2D variant of Kabuki syndrome with Goodpasture's syndrome by whole exome sequencing.,"Li S, Liu J, Yuan Y, Lu A, Liu F, Sun L, Shen Q, Wang L.",Front Pediatr.,2022/08/26,
36071887,"Case report: A Chinese boy with facial dysmorphism, immunodeficiency, livedo, and short stature syndrome.","Jiang L, Chen X, Zheng J, Wang M, Bo H, Liu G.",Front Pediatr.,2022/08/22,
36046249,Case Report: Chinese female patients with a heterozygous pathogenic RPS6KA3 gene variant c.898C>T and distal 22q11.2 microdeletion.,"Cong Y, Jin H, Wu K, Wang H, Wang D.",Front Genet.,2022/08/15,
36033615,Novel compound heterozygous mutation in STAMBP causes a neurodevelopmental disorder by disrupting cortical proliferation.,"Hu M, Li H, Huang Z, Li D, Xu Y, Xu Q, Chen B, Wang Y, Deng J, Zhu M, Feng W, Xu X.",Front Neurosci.,2022/08/10,
35962714,X-linked mental retardation-hypotonic facies syndrome: Exome sequencing identifies novel clinical characteristics associated with c.5182G>C mutation in the ATRX gene.,"Shakarami F, Jahani M, Nouri Z, Tabatabaiefar MA.",Mol Genet Genomic Med.,2022/08/13,
35864517,Kagami-Ogata syndrome: a case report.,"Suriapperuma T, Randeny S, Mettananda S.",J Med Case Rep.,2022/07/22,
35798298,Growth hormone deficiency in a boy with Wiedemann-Steiner syndrome: A case report and review.,"Jung MK, Kim MR, Yoo EG, Rhie S, Seo GH.",Ann Pediatr Endocrinol Metab.,2022/07/30,
35707779,Presentation of an Infant with Chromosome 18p Deletion Syndrome and Asymmetric Septal Hypertrophy.,"Kocaaga A, Yimenicioglu S.",Glob Med Genet.,2022/02/25,
35707592,Delineation of a Phenotype Caused by a KAT6B Missense Variant Not Resembling Say-Barber-Biesecker-Young-Simpson and Genitopatellar Syndromes.,"Nishimura N, Enomoto Y, Kumaki T, Murakami H, Ikeda A, Goto T, Kurosawa K.",Mol Syndromol.,2022/05/13,
35662002,Further characterization of Borjeson-Forssman-Lehmann syndrome in females due to de novo variants in PHF6.,"Gerber CB, Fliedner A, Bartsch O, Berland S, Dewenter M, Haug M, Hayes I, Marin-Reina P, Mark PR, Martinez-Castellano F, Maystadt I, Karadurmus D, Steindl K, Wiesener A, Zweier M, Sticht H, Zweier C.",Clin Genet.,2022/06/14,
35656379,"A Novel Homozygous Missense Variant in the LRRC32 Gene Is Associated With a New Syndrome of Cleft Palate, Progressive Vitreoretinopathy, Growth Retardation, and Developmental Delay.","Hexner-Erlichman Z, Fichtman B, Zehavi Y, Khayat M, Jabaly-Habib H, Izhaki-Tavor LS, Dessau M, Elpeleg O, Spiegel R.",Front Pediatr.,2022/05/17,
35637708,Rubinstein-Taybi Syndrome in a Filipino Infant with a Novel CREBBP Gene Pathogenic Variant.,"Yumul RCR, Chiong MAD.",Case Rep Genet.,2022/05/21,
