pmid,article_name,author,magazine_name,publish_time,
32528716,De novo 2q36.3q37.1 deletion encompassing TRIP12 and NPPC yields distinct phenotypes.,"Kondo Y, Aoyama K, Suzuki H, Hattori A, Hori I, Ito K, Yoshida A, Koroki M, Ueda K, Kosaki K, Saitoh S",Human genome variation,2020/06/13,
32457794,Novel Missense Variant in Heterozygous State in the BRPF1 Gene Leading to Intellectual Developmental Disorder With Dysmorphic Facies and Ptosis.,"Naseer MI, Abdulkareem AA, Guzm¨¢n-Vega FJ, Arold ST, Pushparaj PN, Chaudhary AG, AlQahtani MH",Frontiers in genetics,2020/05/28,
32380822,6q25.1-q25.3 Microdeletion in a Chinese Girl.,"Zhong ML, Song YM, Zou CC",Journal of clinical research in pediatric endocrinology,2020/05/10,
32341814,Mutation in the SLC29A3 Gene in an Egyptian Patient with H Syndrome: A Case Report and Review of Literature.,"El-Bassyouni HT, Thomas MM, Tosson AMS",Journal of pediatric genetics,2020/04/29,
32291808,A novel frameshift variant in SON causes Zhu-Tokita-Takenouchi-Kim Syndrome.,"Tan Y, Duan L, Yang K, Liu Q, Wang J, Dong Z, Li Z, He Y, Yan Y, Lin L",Journal of clinical laboratory analysis,2020/04/16,
32257192,A novel familial mutation associated with Treacher Collins syndrome: A case report.,"Papageorgiou E, Papoulidis I, Zavlanos A, Papanikolaou E, Manolakos E, Fidani S",Biomedical reports,2020/04/8,
32244554,Compound Phenotype Due to Recessive Variants in LARP7 and OTOG Genes Disclosed by an Integrated Approach of SNP-Array and Whole Exome Sequencing.,"Palumbo P, Palumbo O, Leone MP, di Muro E, Castellana S, Bisceglia L, Mazza T, Carella M, Castori M",Genes,2020/04/5,
32222108,A novel UBE2A mutation in a Chinese family with X-linked intellectual disability.,"Jia W, Hu Q, Wu Y, Wang J, Liu Z, Zhang X",The journal of gene medicine,2020/03/30,
32161024,First Korean Case of Coffin-Siris Syndrome with a Novel Frameshift ARID1B Mutation.,"Lee BL, Oh SH, Jun KR, Hur YJ, Lee JE, Keum C, Chung WY",Annals of clinical and laboratory science,2020/03/13,
32141654,Identification of two CUL7 variants in two Chinese families with 3-M syndrome by whole-exome sequencing.,"Hu L, Wang X, Jin T, Han Y, Liu J, Jiang M, Yan S, Fu X, An B, Huang S",Journal of clinical laboratory analysis,2020/03/7,
32128942,Expanding the phenotypic and genotypic spectrum of Wiedemann-Steiner syndrome: First patient from India.,"Arora V, Puri RD, Bijarnia-Mahay S, Verma IC",American journal of medical genetics. Part A,2020/03/5,
32110670,Cutaneous nodules and a novel GNAS mutation in a Chinese boy with pseudohypoparathyroidism type Ia: A case report and review of literature.,"Li YL, Han T, Hong F",World journal of clinical cases,2020/02/29,
32097528,ZMYND11-related syndromic intellectual disability: 16 patients delineating and expanding the phenotypic spectrum.,"Yates TM, Drucker M, Barnicoat A, Low K, Gerkes EH, Fry AE, Parker MJ, ""ODriscoll M"", Charles P, Cox H, Marey I, Keren B, Rinne T, McEntagart M, Ramachandran V, Drury S, Vansenne F, Sival DA, Herkert JC, Callewaert B, Tan WH, Balasubramanian M",Human mutation,2020/02/26,
32050918,Novel PAK3 gene missense variant associated with two Chinese siblings with intellectual disability: a case report.,"Qian Y, Wu B, Lu Y, Zhou W, Wang S, Wang H",BMC medical genetics,2020/02/14,
32041641,Five new cases of syndromic intellectual disability due to KAT6A mutations: widening the molecular and clinical spectrum.,"Urreizti R, Lopez-Martin E, Martinez-Monseny A, Pujadas M, Castilla-Vallmanya L, P¨¦rez-Jurado LA, Serrano M, Natera-de Benito D, Mart¨ªnez-Delgado B, Posada-de-la-Paz M, Alonso J, Marin-Reina P, ""OCallaghan M"", Grinberg D, Bermejo-S¨¢nchez E, Balcells S",Orphanet journal of rare diseases,2020/02/12,
32021610,Cardiofaciocutaneous Syndrome Phenotype in a Case with de novo KRAS Pathogenic Variant.,"Sanri A, Gurkan H, Demir S",Molecular syndromology,2020/02/6,
31972311,Cardio-facio-cutaneous syndrome-associated pathogenic MAP2K1 variants activate autophagy.,"Chen J, Che L, Xu C, Zhao S, Yang J, Li M, Li G, Shen Y",Gene,2020/01/24,
31953237,A novel SPECC1L mutation causing Teebi hypertelorism syndrome: Expanding phenotypic and genetic spectrum.,"Zhang T, Wu Q, Zhu L, Wu D, Yang R, Qi M, Huang X",European journal of medical genetics,2020/01/19,
31925597,Identification and characterization of novel mutations in MOGS in a Chinese patient with infantile spams.,"Peiwei Zhao, Peng X, Luo S, Huang Y, Tan L, Shao J, He X",Neurogenetics,2020/01/12,
31916397,Novel truncating variant of PPM1D penultimate exon in a Chinese patient with Jansen-de Vries syndrome.,"Li Z, Du C, Zhang C, Zhang M, Ying Y, Liang Y, Luo X",Molecular genetics & genomic medicine,2020/01/10,
31903734,A de novo MAPRE2 variant in a patient with congenital symmetric circumferential skin creases type 2.,"Feng J, Lan X, Shen J, Song X, Tang X, Xu W, Ren X, Zhang H, Yu G, Wu S",Molecular genetics & genomic medicine,2020/01/7,
31835735,Novel JAG1 Deletion Variant in Patient with Atypical Alagille Syndrome.,"Micaglio E, Andronache AA, Carrera P, Monasky MM, Locati ET, Pirola B, Presi S, Carminati M, Ferrari M, Giamberti A, Pappone C",International journal of molecular sciences,2019/12/15,
31834374,MN1 C-terminal truncation syndrome is a novel neurodevelopmental and craniofacial disorder with partial rhombencephalosynapsis.,"Mak CCY, Doherty D, Lin AE, Vegas N, Cho MT, Viot G, Dimartino C, Weisfeld-Adams JD, Lessel D, Joss S, Li C, Gonzaga-Jauregui C, Zarate YA, Ehmke N, Horn D, Troyer C, Kant SG, Lee Y, Ishak GE, Leung G, Barone Pritchard A, Yang S, Bend EG, Filippini F, Roadhouse C, Lebrun N, Mehaffey MG, Martin PM, Apple B, Millan F, Puk O, Hoffer MJV, Henderson LB, McGowan R, Wentzensen IM, Pei S, Zahir FR, Yu M, Gibson WT, Seman A, Steeves M, Murrell JR, Luettgen S, Francisco E, Strom TM, Amlie-Wolf L, Kaindl AM, Wilson WG, Halbach S, Basel-Salmon L, Lev-El N, Denecke J, Vissers LELM, Radtke K, Chelly J, Zackai E, Friedman JM, Bamshad MJ, Nickerson DA, University of Washington Center for Mendelian Genomics, Reid RR, Devriendt K, Chae JH, Stolerman E, McDougall C, Powis Z, Bienvenu T, Tan TY, Orenstein N, Dobyns WB, Shieh JT, Choi M, Waggoner D, Gripp KW, Parker MJ, Stoler J, Lyonnet S, Cormier-Daire V, Viskochil D, Hoffman TL, Amiel J, Chung BHY, Gordon CT",Brain : a journal of neurology,2019/12/14,
31833172,TFE3-associated neurodevelopmental disorder: A distinct recognizable syndrome.,"Diaz J, Berger S, Leon E",American journal of medical genetics. Part A,2019/12/14,
31806011,EFTUD2 gene deficiency disrupts osteoblast maturation and inhibits chondrocyte differentiation via activation of the p53 signaling pathway.,"Wu J, Yang Y, He Y, Li Q, Wang X, Sun C, Wang L, An Y, Luo F",Human genomics,2019/12/7,
31803247,A De Novo Mutation in DYRK1A Causes Syndromic Intellectual Disability: A Chinese Case Report.,"Qiao F, Shao B, Wang C, Wang Y, Zhou R, Liu G, Meng L, Hu P, Xu Z",Frontiers in genetics,2019/12/6,
31803239,Rare De Novo IGF2 Variant on the Paternal Allele in a Patient With Silver-Russell Syndrome.,"Xia CL, Lyu Y, Li C, Li H, Zhang ZT, Yin SW, Mao Y, Li W, Kong LY, Liang B, Jiang HK, Li-Ling J, Liu CX, Wei J",Frontiers in genetics,2019/12/6,
31775791,A 9-year-old Korean girl with Fontaine progeroid syndrome: a case report with further phenotypical delineation and description of clinical course during long-term follow-up.,"Ryu J, Ko JM, Shin CH",BMC medical genetics,2019/11/30,
31649276,POLR1B and neural crest cell anomalies in Treacher Collins syndrome type 4.,"Sanchez E, Laplace-Builh¨¦ B, Mau-Them FT, Richard E, Goldenberg A, Toler TL, Guignard T, Gatinois V, Vincent M, Blanchet C, Boland A, Bihoreau MT, Deleuze JF, Olaso R, Nephi W, L¨¹decke HJ, Verheij JBGM, Moreau-Lenoir F, Denoyelle F, Rivi¨¨re JB, Laplanche JL, Willing M, Captier G, Apparailly F, Wieczorek D, Collet C, Djouad F, Genevi¨¨ve D",Genetics in medicine : official journal of the American College of Medical Genetics,2019/10/28,
31640617,Inherited FGFR2 mutation in a Chinese patient with Crouzon syndrome and luxation of bulbus oculi provoked by trauma: a case report.,"Yang J, Tao T, Liu H, Hu ZL",BMC ophthalmology,2019/10/24,
31633297,Biallelic mutation of FBXL7 suggests a novel form of Hennekam syndrome.,"Boone PM, Paterson S, Mohajeri K, Zhu W, Genetti CA, Tai DJC, Nori N, Agrawal PB, Bacino CA, Bi W, Talkowski ME, Hogan BM, Rodan LH",American journal of medical genetics. Part A,2019/10/22,
31566921,A novel splice site mutation in the UBE2A gene leads to aberrant mRNA splicing in a Chinese patient with X-linked intellectual disability type Nascimento.,"Ma D, Tan J, Zhou J, Zhang J, Cheng J, Luo C, Liu G, Wang Y, Xu Z",Molecular genetics & genomic medicine,2019/10/1,
31429857,Non-mosaic partial duplication 12p in a patient with dysmorphic characteristics and developmental delay.,"Oliveira JS, Joaquim TM, Silva RABD, Souza DH, Martelli LR, Moretti-Ferreira D",Genetics and molecular biology,2019/08/21,
31413053,Mandibulofacial dysostosis with microcephaly: a syndrome to remember.,"Silva JB, Soares D, Le?o M, Santos H",BMJ case reports,2019/08/16,
31382906,De novo truncating variant in NSD2gene leading to atypical Wolf-Hirschhorn syndrome phenotype.,"Jiang Y, Sun H, Lin Q, Wang Z, Wang G, Wang J, Jiang F, Yao R",BMC medical genetics,2019/08/7,
31318164,"Extremely severe scoliosis, heterotopic ossification, and osteoarthritis in a three-generation family with Crouzon syndrome carrying a mutant c.799T>C FGFR2.","Lin M, Lu Y, Sui Y, Zhao N, Jin Y, Yi D, Jiang M",Molecular genetics & genomic medicine,2019/07/19,
31250358,A novel de novo mutation (p.Pro1310Glnfs*46) in KMT2A caused Wiedemann-Steiner Syndrome in a Chinese boy with postnatal growth retardation: a case report.,"Chen M, Liu R, Wu C, Li X, Wang Y",Molecular biology reports,2019/06/30,
31192177,"Phenotypic Overlap of Roberts and Baller-Gerold Syndromes in Two Patients With Craniosynostosis, Limb Reductions, and ESCO2 Mutations.","Colombo EA, Mutlu-Albayrak H, Shafeghati Y, Balasar M, Piard J, Gentilini D, Di Blasio AM, Gervasini C, Van Maldergem L, Larizza L",Frontiers in pediatrics,2019/06/14,
31182893,Syndromic Intellectual Disability Caused by a Novel Truncating Variant in AHDC1: A Case Report.,"D¨ªaz-Ordo?ez L, Ramirez-Monta?o D, Candelo E, Cruz S, Pachajoa H",Iranian journal of medical sciences,2019/06/12,
31176769,"Novel BRPF1 mutation in a boy with intellectual disability, coloboma, facial nerve palsy and hypoplasia of the corpus callosum.","Demeulenaere S, Beysen D, De Veuster I, Reyniers E, Kooy F, Meuwissen M",European journal of medical genetics,2019/06/10,
31173466,Severe Noonan syndrome phenotype associated with a germline Q71R MRAS variant: a recurrent substitution in RAS homologs in various cancers.,"Suzuki H, Takenouchi T, Uehara T, Takasago S, Ihara S, Yoshihashi H, Kosaki K",American journal of medical genetics. Part A,2019/06/8,
31160359,Partial Jacobsen syndrome phenotype in a patient with a de novo frameshift mutation in the ETS1 transcription factor.,"Tootleman E, Malamut B, Akshoomoff N, Mattson SN, Hoffman HM, Jones MC, Printz B, Shiryaev SA, Grossfeld P",Cold Spring Harbor molecular case studies,2019/06/5,
31157196,Alagille Syndrome: A Novel Mutation in JAG1 Gene.,"Fischetto R, Palmieri VV, Tripaldi ME, Gaeta A, Michelucci A, Delvecchio M, Francavilla R, Giordano P",Frontiers in pediatrics,2019/06/4,
31145547,RAF1 variant in a patient with Noonan syndrome with multiple lentigines and craniosynostosis.,"Rodr¨ªguez F, Ponce D, Berward FJ, Lopetegui B, Cassorla F, Aracena M",American journal of medical genetics. Part A,2019/05/31,
31107123,Genotype-phenotype variability in Chinese cases of Treacher Collins syndrome.,"Li X, Su Y, Huang S, Gao B, Zhang D, Wang X, Gao Q, Pang H, Zhao Y, Yuan Y, Dai P",Acta oto-laryngologica,2019/05/21,
31102500,A novel biallelic loss-of-function mutation in TMCO1 gene confirming and expanding the phenotype spectrum of cerebro-facio-thoracic dysplasia.,"Sharkia R, Zalan A, Jabareen-Masri A, Hengel H, Sch?ls L, Kessel A, Azem A, Mahajnah M",American journal of medical genetics. Part A,2019/05/19,
31053780,A novel de novo MTOR gain-of-function variant in a patient with Smith-Kingsmore syndrome and Antiphospholipid syndrome.,"Rodr¨ªguez-Garc¨ªa ME, Cotrina-Vinagre FJ, Bellusci M, Mart¨ªnez de Arag¨®n A, Hern¨¢ndez-S¨¢nchez L, Carnicero-Rodr¨ªguez P, Mart¨ªn-Hern¨¢ndez E, Mart¨ªnez-Azor¨ªn F",European journal of human genetics : EJHG,2019/05/6,
31020800,"BRPF1-associated intellectual disability, ptosis, and facial dysmorphism in a multiplex family.","Pode-Shakked N, Barel O, Pode-Shakked B, Eliyahu A, Singer A, Nayshool O, Kol N, Raas-Rothschild A, Pras E, Shohat M",Molecular genetics & genomic medicine,2019/04/26,
30997052,"Developmental delay, coarse facial features, and epilepsy in a patient with EXT2 gene variants.","Gupta A, Ewing SA, Renaud DL, Hasadsri L, Raymond KM, Klee EW, Gavrilova RH",Clinical case reports,2019/04/19,
30982611,Pathogenic Variants in GPC4 Cause Keipert Syndrome.,"Amor DJ, Stephenson SEM, Mustapha M, Mensah MA, Ockeloen CW, Lee WS, Tankard RM, Phelan DG, Shinawi M, de Brouwer APM, Pfundt R, Dowling C, Toler TL, Sutton VR, Agolini E, Rinelli M, Capolino R, Martinelli D, Zampino G, Dumi? M, Reardon W, Shaw-Smith C, Leventer RJ, Delatycki MB, Kleefstra T, Mundlos S, Mortier G, Bahlo M, Allen NJ, Lockhart PJ",American journal of human genetics,2019/04/16,
30973214,Retinal dystrophy in an individual carrying a de novo missense variant of SMARCA4.,"Cappuccio G, Brunetti-Pierri R, Torella A, Pinelli M, Castello R, Casari G, Nigro V, Banfi S, Simonelli F, TUDP, Brunetti-Pierri N",Molecular genetics & genomic medicine,2019/04/12,
30929739,"De Novo and Inherited Pathogenic Variants in KDM3B Cause Intellectual Disability, Short Stature, and Facial Dysmorphism.","Diets IJ, van der Donk R, Baltrunaite K, Waanders E, Reijnders MRF, Dingemans AJM, Pfundt R, Vulto-van Silfhout AT, Wiel L, Gilissen C, Thevenon J, Perrin L, Afenjar A, Nava C, Keren B, Bartz S, Peri B, Beunders G, Verbeek N, van Gassen K, Thiffault I, Cadieux-Dion M, Huerta-Saenz L, Wagner M, Konstantopoulou V, Vodopiutz J, Griese M, Boel A, Callewaert B, Brunner HG, Kleefstra T, Hoogerbrugge N, de Vries BBA, Hwa V, Dauber A, Hehir-Kwa JY, Kuiper RP, Jongmans MCJ",American journal of human genetics,2019/04/2,
30849546,Whole-exome sequencing in a Japanese pedigree implicates a rare non-synonymous single-nucleotide variant in BEST3 as a candidate for mandibular prognathism.,"Kajii TS, Oka A, Saito F, Mitsui J, Iida J",Bone,2019/03/9,
30733662,A Novel Mutation of KIF11 in a Child with 22q11.2 Deletion Syndrome Associated with MCLMR.,"G¨¹ne? N, Ta?demir E, Jeffery H, Yetik H, Ostergaard P, T¨¹ys¨¹z B",Molecular syndromology,2019/02/9,
30719288,Detection of G338R FGFR2 mutation in a Vietnamese patient with Crouzon syndrome.,"Luong ALT, Ho TT, Hoang H, Nguyen TQ, Ho TC, Tran PD, Hoang TT, Nguyen NT, Chu HH",Biomedical reports,2019/02/6,
30670789,"A distinct neurodevelopmental syndrome with intellectual disability, autism spectrum disorder, characteristic facies, and macrocephaly is caused by defects in CHD8.","Yasin H, Gibson WT, Langlois S, Stowe RM, Tsang ES, Lee L, Poon J, Tran G, Tyson C, Wong CK, Marra MA, Friedman JM, Zahir FR",Journal of human genetics,2019/01/24,
30615951,Microdeletion and microduplication of 1p36.11p35.3 involving AHDC1 contribute to neurodevelopmental disorder.,"Wang Q, Huang X, Liu Y, Peng Q, Zhang Y, Liu J, Yuan H",European journal of medical genetics,2019/01/8,
30569574,SOFT syndrome in a patient from Chile.,"Saida K, Silva S, Solar B, Fujita A, Hamanaka K, Mitsuhashi S, Koshimizu E, Mizuguchi T, Miyatake S, Takata A, Miyake N, Matsumoto N",American journal of medical genetics. Part A,2018/12/21,
30549423,A case of YY1-associated syndromic learning disability or Gabriele-de Vries syndrome with myasthenia gravis.,"Morales-Rosado JA, Kaiwar C, Smith BE, Klee EW, Dhamija R",American journal of medical genetics. Part A,2018/12/15,
30482549,A novel mutation in the GATAD2B gene associated with severe intellectual disability.,"Ueda K, Yanagi K, Kaname T, Okamoto N",Brain & development,2018/11/30,
30481285,"Biallelic variants in FBXL3 cause intellectual disability, delayed motor development and short stature.","Ansar M, Paracha SA, Serretti A, Sarwar MT, Khan J, Ranza E, Falconnet E, Iwaszkiewicz J, Shah SF, Qaisar AA, Santoni FA, Zoete V, Megarbane A, Ahmed J, Colombo R, Makrythanasis P, Antonarakis SE",Human molecular genetics,2018/11/28,
30468148,A Case of Cleidocranial Dysplasia with a Novel Mutation and Growth Velocity Gain with Growth Hormone Treatment.,"?amtosun E, Ak?nc? A, Demiral E, Tekedereli ?, S???rc? A",Journal of clinical research in pediatric endocrinology,2018/11/24,
30425916,Floating-Harbor Syndrome: Presentation of the First Romanian Patient with a SRCAP Mutation and Review of the Literature.,"Budisteanu M, B?gershausen N, Papuc SM, Moosa S, Thoenes M, Riga D, Arghir A, Wollnik B",Balkan journal of medical genetics : BJMG,2018/11/15,
30352594,Role of PUF60 gene in Verheij syndrome: a case report of the first Chinese Han patient with a de novo pathogenic variant and review of the literature.,"Xu Q, Li CY, Wang Y, Li HP, Wu BB, Jiang YH, Xu X",BMC medical genomics,2018/10/26,
30310776,SOFT Syndrome: The First Case in Iran.,"Mostofizadeh N, Gheidarloo M, Hashemipour M, Dehkordi EH",Advanced biomedical research,2018/10/13,
30304910,The first Korean case with Floating-Harbor syndrome with a novel SRCAP mutation diagnosed by targeted exome sequencing.,"Choi EM, Lee DH, Kang SJ, Shim YJ, Kim HS, Kim JS, Jeong JI, Ha JS, Jang JH",Korean journal of pediatrics,2018/10/12,
30244542,Phenotypic and molecular insights into PQBP1-related intellectual disability.,"Abdel-Salam GMH, Miyake N, Abdel-Hamid MS, Sayed ISM, Gadelhak MI, Ismail SI, Aglan MS, Afifi HH, Temtamy SA, Matsumoto N",American journal of medical genetics. Part A,2018/09/24,
30213762,"Further evidence of a causal association between AGO1, a critical regulator of microRNA formation, and intellectual disability/autism spectrum disorder.","Sakaguchi A, Yamashita Y, Ishii T, Uehara T, Kosaki K, Takahashi T, Takenouchi T",European journal of medical genetics,2018/09/15,
30208878,GNPTAB c.2404C?>?T nonsense mutation in a patient with mucolipidosis III alpha/beta: a case report.,"Ho CC, Tsung LL, Liu KT, Poon WT",BMC medical genetics,2018/09/14,
30186496,Identification of a novel TCOF1 mutation in a Chinese family with Treacher Collins syndrome.,"Yan Z, Lu Y, Wang Y, Zhang X, Duan H, Cheng J, Yuan H, Han D",Experimental and therapeutic medicine,2018/09/7,
30181650,"Co-occurrence of mutations in FOXP1 and PTCH1 in a girl with extreme megalencephaly, callosal dysgenesis and profound intellectual disability.","Zombor M, Kalm¨¢r T, Mar¨®ti Z, Zimmermann A, M¨¢t¨¦ A, Bereczki C, Sztriha L",Journal of human genetics,2018/09/6,
30122539,De Novo Mutations of CCNK Cause a Syndromic Neurodevelopmental Disorder with Distinctive Facial Dysmorphism.,"Fan Y, Yin W, Hu B, Kline AD, Zhang VW, Liang D, Sun Y, Wang L, Tang S, Powis Z, Li L, Yan H, Shi Z, Yang X, Chen Y, Wang J, Jiang Y, Tan H, Gu X, Wu L, Yu Y",American journal of human genetics,2018/08/21,
30089473,FLNA mutations in surviving males presenting with connective tissue findings: two new case reports and review of the literature.,"Cannaerts E, Shukla A, Hasanhodzic M, Alaerts M, Schepers D, Van Laer L, Girisha KM, Hojsak I, Loeys B, Verstraeten A",BMC medical genetics,2018/08/10,
29868125,Apert Syndrome With FGFR2 758 C > G Mutation: A Chinese Case Report.,"Li Y, Ma D, Sun Y, Meng L, Wang Y, Jiang T",Frontiers in genetics,2018/06/6,
29808498,"PPP1R21 homozygous null variants associated with developmental delay, muscle weakness, distinctive facial features, and brain abnormalities.","Suleiman J, Al Hashem AM, Tabarki B, Al-Thihli K, Bi W, El-Hattab AW",Clinical genetics,2018/05/29,
29752200,"Distinctive facies, macrocephaly, and developmental delay are signs of a PTEN mutation in childhood.","Kato K, Mizuno S, Inaba M, Fukumura S, Kurahashi N, Maruyama K, Ieda D, Ohashi K, Hori I, Negishi Y, Hattori A, Saitoh S",Brain & development,2018/05/13,
29683802,A study of familial Char syndrome involving the TFAP2B gene with a focus on facial shape characteristics.,"Nyboe D, Kreiborg S, Darvann T, Dun? M, Nissen KR, Hove HB",Clinical dysmorphology,2018/04/24,
29682451,"Cerebro-facio-thoracic dysplasia (Pascual-Castroviejo syndrome): Identification of a novel mutation, use of facial recognition analysis, and review of the literature.","Tender JAF, Ferreira CR",Translational science of rare diseases,2018/04/24,
29572195,Biallelic UNC80 mutations caused infantile hypotonia with psychomotor retardation and characteristic facies 2 in two Chinese patients with variable phenotypes.,"He Y, Ji X, Yan H, Ye X, Liu Y, Wei W, Xiao B, Sun Y",Gene,2018/03/25,
29519750,De novo HDAC8 mutation causes Rett-related disorder with distinctive facial features and multiple congenital anomalies.,"Saikusa T, Hara M, Iwama K, Yuge K, Ohba C, Okada JI, Hisano T, Yamashita Y, Okamoto N, Saitsu H, Matsumoto N, Matsuishi T",Brain & development,2018/03/10,
29462647,Novel pathogenic RECQL4 variants in Chinese patients with Rothmund-Thomson syndrome.,"Gui B, Song Y, Hu X, Li H, Qin Z, Su J, Li C, Fan X, Li M, Luo J, Feng Y, Song L, Chen S, Gong C, Shen Y",Gene,2018/02/21,
29445472,Mild prominence of the Sylvian fissure in a Bainbridge-Ropers syndrome patient with a novel frameshift variant in ASXL3.,"Chinen Y, Nakamura S, Ganaha A, Hayashi S, Inazawa J, Yanagi K, Nakanishi K, Kaname T, Naritomi K",Clinical case reports,2018/02/16,
29410513,A novel homozygous DPH1 mutation causes intellectual disability and unique craniofacial features.,"Sekiguchi F, Nasiri J, Sedghi M, Salehi M, Hosseinzadeh M, Okamoto N, Mizuguchi T, Nakashima M, Miyatake S, Takata A, Miyake N, Matsumoto N",Journal of human genetics,2018/02/8,
29384951,Cole-Carpenter syndrome-1 with a de novo heterozygous deletion in the P4HB gene in a Chinese girl: A case report.,"Ouyang L, Yang F",Medicine,2018/02/1,
29383834,Nonsense mutations in FZD2 cause autosomal-dominant omodysplasia: Robinow syndrome-like phenotypes.,"Nagasaki K, Nishimura G, Kikuchi T, Nyuzuki H, Sasaki S, Ogawa Y, Saitoh A",American journal of medical genetics. Part A,2018/02/1,
29381487,Mandibulofacial dysostosis Guion-Almeida type caused by novel EFTUD2 splice site variants in two Asian children.,"Yu KPT, Luk HM, Gordon CT, Fung G, Oufadem M, Garcia-Barcelo MM, Amiel J, Chung BHY, Lo IFM, Tiong YT",Clinical dysmorphology,2018/01/31,
29096665,Genotype-phenotype correlations and expansion of the molecular spectrum of AP4M1-related hereditary spastic paraplegia.,"Bettencourt C, Salpietro V, Efthymiou S, Chelban V, Hughes D, Pittman AM, Federoff M, Bourinaris T, Spilioti M, Deretzi G, Kalantzakou T, Houlden H, Singleton AB, Xiromerisiou G",Orphanet journal of rare diseases,2017/11/4,
29090019,Molecular characterization and evaluation of complex rearrangements in a case of ring chromosome 15.,"Tewari S, Lubna N, Shah R, Al-Rikabi ABH, Shah K, Sheth J, Sheth F",Molecular cytogenetics,2017/11/2,
29062322,Whole Gene Deletion of EBF3 Supporting Haploinsufficiency of This Gene as a Mechanism of Neurodevelopmental Disease.,"Lopes F, Soares G, Gon?alves-Rocha M, Pinto-Basto J, Maciel P",Frontiers in genetics,2017/10/25,
28948053,A SMARCA2 Mutation in the First Case Report of Nicolaides-Baraitser Syndrome in Latin America: Genotype-Phenotype Correlation.,"S¨¢nchez AI, Rojas JA",Case reports in genetics,2017/09/28,
28917829,A chinese boy with geleophysic dysplasia caused by compound heterozygous mutations in ADAMTSL2.,"Li D, Dong H, Zheng H, Song J, Li X, Jin Y, Liu Y, Yang Y",European journal of medical genetics,2017/09/18,
28905509,De novo SETD5 loss-of-function variant as a cause for intellectual disability in a 10-year old boy with an aberrant blind ending bronchus.,"Green C, Willoughby J, DDD Study, Balasubramanian M",American journal of medical genetics. Part A,2017/09/15,
28900819,"A homozygous PIGO mutation associated with severe infantile epileptic encephalopathy and corpus callosum hypoplasia, but normal alkaline phosphatase levels.","Zehavi Y, von Renesse A, Daniel-Spiegel E, Sapir Y, Zalman L, Chervinsky I, Schuelke M, Straussberg R, Spiegel R",Metabolic brain disease,2017/09/14,
28815892,Preaxial polydactyly in an individual with Wiedemann-Steiner syndrome caused by a novel nonsense mutation in KMT2A.,"Enokizono T, Ohto T, Tanaka R, Tanaka M, Suzuki H, Sakai A, Imagawa K, Fukushima H, Iwabuti A, Fukushima T, Sumazaki R, Uehara T, Takenouchi T, Kosaki K",American journal of medical genetics. Part A,2017/08/18,
28794914,Hyperphosphatasia with Mental Retardation Syndrome Due to a Novel Mutation in PGAP3.,"Nampoothiri S, Hebbar M, Roy AG, Kochumon SP, Bielas S, Shukla A, Girisha KM",Journal of pediatric genetics,2017/08/11,
28735298,FOXP1-related intellectual disability syndrome: a recognisable entity.,"Meerschaut I, Rochefort D, Reven?u N, P¨¨tre J, Corsello C, Rouleau GA, Hamdan FF, Michaud JL, Morton J, Radley J, Ragge N, Garc¨ªa-Mi?a¨²r S, Lapunzina P, Bralo MP, Mori M¨¢, Moortgat S, Benoit V, Mary S, Bockaert N, Oostra A, Vanakker O, Velinov M, de Ravel TJ, Mekahli D, Sebat J, Vaux KK, DiDonato N, Hanson-Kahn AK, Hudgins L, Dallapiccola B, Novelli A, Tarani L, Andrieux J, Parker MJ, Neas K, Ceulemans B, Schoonjans AS, Prchalova D, Havlovicova M, Hancarova M, Budisteanu M, Dheedene A, Menten B, Dion PA, Lederer D, Callewaert B",Journal of medical genetics,2017/07/25,
28690993,2q37 Deletion syndrome confirmed by high-resolution cytogenetic analysis.,"Cho EK, Kim J, Yang A, Cho SY, Jin DK",Annals of pediatric endocrinology & metabolism,2017/07/12,
